path,size_bytes,modified,extension
"./.DS_Store",32772,"2025-11-30 20:53:34","DS_Store"
"./inventory_project.sh",1970,"2025-11-30 21:16:59","sh"
"./web/HADER_12wk_Execution_Kit.xlsx",11730,"2025-11-12 10:17:55","xlsx"
"./web/WhatsApp Imageâ€ 2025-11-11 at 17.23.48.jpeg",80974,"2025-11-11 18:27:34","jpeg"
"./web/HADER_Bilingual_Master_SST_v1_7_CHECKLIST_AR.md",1197,"2025-11-12 00:42:59","md"
"./web/Ecart - Required Data .pdf",105938,"2025-11-11 17:57:56","pdf"
"./web/web req/Gemini_Generated_Image_kw5qw3kw5qw3kw5q.png",977272,"2025-11-12 14:10:10","png"
"./web/web req/hader_logo_color.png",1115674,"2025-11-12 14:02:58","png"
"./web/web req/.DS_Store",10244,"2025-11-15 16:18:02","DS_Store"
"./web/web req/HADER_Shopify_Launch_Pack_v1.7/.DS_Store",14340,"2025-11-12 13:06:50","DS_Store"
"./web/web req/HADER_Shopify_Launch_Pack_v1.7/brand/email_signature.html",1186,"2025-11-12 10:47:22","html"
"./web/web req/HADER_Shopify_Launch_Pack_v1.7/brand/brand_tokens.json",592,"2025-11-12 10:47:22","json"
"./web/web req/HADER_Shopify_Launch_Pack_v1.7/marketing/social_bios.txt",817,"2025-11-12 10:47:22","txt"
"./web/web req/HADER_Shopify_Launch_Pack_v1.7/marketing/whatsapp_autoreply_flows.txt",1433,"2025-11-12 10:47:22","txt"
"./web/web req/HADER_Shopify_Launch_Pack_v1.7/seo/organization.jsonld",1296,"2025-11-12 10:47:22","jsonld"
"./web/web req/HADER_Shopify_Launch_Pack_v1.7/seo/website.jsonld",337,"2025-11-12 10:47:22","jsonld"
"./web/web req/HADER_Shopify_Launch_Pack_v1.7/seo/faqpage.jsonld",1058,"2025-11-12 10:47:22","jsonld"
"./web/web req/HADER_Shopify_Launch_Pack_v1.7/data/shipping_rates.csv",168,"2025-11-12 10:47:22","csv"
"./web/web req/HADER_Shopify_Launch_Pack_v1.7/pages/shipping_ar_en.md",830,"2025-11-12 10:47:22","md"
"./web/web req/HADER_Shopify_Launch_Pack_v1.7/pages/contact_ar_en.md",1370,"2025-11-12 10:47:22","md"
"./web/web req/HADER_Shopify_Launch_Pack_v1.7/pages/faqs_ar_en.md",1393,"2025-11-12 10:47:22","md"
"./web/web req/HADER_Shopify_Launch_Pack_v1.7/pages/privacy_ar_en.md",347,"2025-11-12 10:47:22","md"
"./web/web req/HADER_Shopify_Launch_Pack_v1.7/pages/returns_ar_en.md",365,"2025-11-12 10:47:22","md"
"./web/web req/HADER_Shopify_Launch_Pack_v1.7/pages/about_ar_en.md",1094,"2025-11-12 10:47:22","md"
"./web/web req/HADER_Shopify_Launch_Pack_v1.7/store/.DS_Store",8196,"2025-11-12 13:06:45","DS_Store"
"./web/web req/HADER_Shopify_Launch_Pack_v1.7/store/product_template_example.json",1465,"2025-11-12 10:47:22","json"
"./web/web req/HADER_Shopify_Launch_Pack_v1.7/store/collections.json",1839,"2025-11-12 10:47:22","json"
"./web/web req/HADER_Shopify_Launch_Pack_v1.7/store/policies_json/shopify_policies.json",899,"2025-11-12 10:47:22","json"
"./web/web req/Gemini_Generated_Image_5sk1gt5sk1gt5sk1.png",825307,"2025-11-12 14:09:03","png"
"./web/web req/hader_logo_safezone.png",1167061,"2025-11-12 14:03:20","png"
"./web/web req/hader_logo_color.svg",1487735,"2025-11-12 14:03:14","svg"
"./web/web req/hader_logo_mono_blue.png",49591,"2025-11-12 14:03:04","png"
"./web/web req/README.md",405,"2025-11-12 14:03:22","md"
"./web/web req/hader_logo_mono_red.png",49589,"2025-11-12 14:03:08","png"
"./web/web req/_tree.txt",1414,"2025-11-12 12:59:44","txt"
"./web/web req/HADER_Shopify_Launch_Pack_v1.7.zip",10445,"2025-11-12 12:49:51","zip"
"./web/web req/_previews/.DS_Store",8196,"2025-11-15 16:18:02","DS_Store"
"./web/web req/_previews/_tree.txt.preview.txt",1414,"2025-11-12 12:59:44","txt"
"./web/web req/_previews/HADER_Shopify_Launch_Pack_v1.7/.DS_Store",6148,"2025-11-15 16:17:31","DS_Store"
"./web/web req/_previews/HADER_Shopify_Launch_Pack_v1.7/brand/brand_tokens.json.preview.txt",592,"2025-11-12 12:59:44","txt"
"./web/web req/_previews/HADER_Shopify_Launch_Pack_v1.7/brand/email_signature.html.preview.txt",1186,"2025-11-12 12:59:44","txt"
"./web/web req/_previews/HADER_Shopify_Launch_Pack_v1.7/marketing/whatsapp_autoreply_flows.txt.preview.txt",1433,"2025-11-12 12:59:44","txt"
"./web/web req/_previews/HADER_Shopify_Launch_Pack_v1.7/marketing/social_bios.txt.preview.txt",817,"2025-11-12 12:59:44","txt"
"./web/web req/_previews/HADER_Shopify_Launch_Pack_v1.7/data/shipping_rates.csv.preview.txt",168,"2025-11-12 12:59:44","txt"
"./web/web req/_previews/HADER_Shopify_Launch_Pack_v1.7/pages/contact_ar_en.md.preview.txt",1370,"2025-11-12 12:59:44","txt"
"./web/web req/_previews/HADER_Shopify_Launch_Pack_v1.7/pages/privacy_ar_en.md.preview.txt",347,"2025-11-12 12:59:44","txt"
"./web/web req/_previews/HADER_Shopify_Launch_Pack_v1.7/pages/about_ar_en.md.preview.txt",1094,"2025-11-12 12:59:44","txt"
"./web/web req/_previews/HADER_Shopify_Launch_Pack_v1.7/pages/returns_ar_en.md.preview.txt",365,"2025-11-12 12:59:44","txt"
"./web/web req/_previews/HADER_Shopify_Launch_Pack_v1.7/pages/faqs_ar_en.md.preview.txt",1393,"2025-11-12 12:59:44","txt"
"./web/web req/_previews/HADER_Shopify_Launch_Pack_v1.7/pages/shipping_ar_en.md.preview.txt",830,"2025-11-12 12:59:44","txt"
"./web/web req/_previews/HADER_Shopify_Launch_Pack_v1.7/store/product_template_example.json.preview.txt",1465,"2025-11-12 12:59:44","txt"
"./web/web req/_previews/HADER_Shopify_Launch_Pack_v1.7/store/policies_json/shopify_policies.json.preview.txt",899,"2025-11-12 12:59:44","txt"
"./web/web req/_previews/HADER_Shopify_Launch_Pack_v1.7/store/collections.json.preview.txt",1839,"2025-11-12 12:59:44","txt"
"./web/web req/hader_logo_mono_black.svg",66039,"2025-11-12 14:03:16","svg"
"./web/web req/Gemini_Generated_Image_dpjnnudpjnnudpjn.png",930338,"2025-11-12 14:01:16","png"
"./web/web req/HADER_assets_campaign_Ù‚ÙˆØ³-Ø§Ù„Ø«Ù‚Ø©.zip",9457,"2025-11-12 15:41:21","zip"
"./web/web req/hader_logo_mono_black.png",49403,"2025-11-12 14:02:59","png"
"./web/web req/Gemini_Generated_Image_hpftsqhpftsqhpft.png",1125624,"2025-11-12 13:59:38","png"
"./web/web req/_index.tsv",3103,"2025-11-12 12:59:44","tsv"
"./web/.DS_Store",20484,"2025-11-30 20:53:34","DS_Store"
"./web/HADER_Bilingual_Master_SST_v1_7.yaml",10699,"2025-11-12 00:42:49","yaml"
"./web/flowith/pure_code_html_content.md",14591,"2025-11-29 03:55:53","md"
"./web/flowith/HaderOS_Architecture_Arabic.md",73138,"2025-11-29 02:26:52","md"
"./web/flowith/HaderOS_Architecture_Arabic.md.meta.json",258,"2025-11-29 02:26:52","json"
"./web/flowith/code_content_2025-11-29T01-01-31.md.meta.json",263,"2025-11-29 03:01:52","json"
"./web/flowith/technical_specifications_source.md",10879,"2025-11-29 02:44:52","md"
"./web/flowith/extracted_code_html_ready.md",13816,"2025-11-29 03:05:22","md"
"./web/flowith/fixed_html_pages.md.meta.json",369,"2025-11-29 03:50:23","json"
"./web/flowith/extracted_code_html_ready.md.meta.json",378,"2025-11-29 03:05:22","json"
"./web/flowith/code_content_2025-11-29T01-03-29.md",9279,"2025-11-29 03:03:52","md"
"./web/flowith/technical_specifications_source.md.meta.json",262,"2025-11-29 02:44:52","json"
"./web/flowith/index.html",8982,"2025-11-29 03:51:23","html"
"./web/flowith/.DS_Store",22532,"2025-11-30 20:53:34","DS_Store"
"./web/flowith/governance.html.meta.json",287,"2025-11-29 03:51:23","json"
"./web/flowith/governance.html",2328,"2025-11-29 03:51:23","html"
"./web/flowith/architecture_html_source.md.meta.json",377,"2025-11-29 02:32:22","json"
"./web/flowith/final_code_html_for_real.md",14230,"2025-11-29 04:00:53","md"
"./web/flowith/fixed_html_pages.md",13444,"2025-11-29 03:50:23","md"
"./web/flowith/code_content_2025-11-29T01-09-18.md.meta.json",263,"2025-11-29 03:09:22","json"
"./web/flowith/final_code_html.md.md",13751,"2025-11-29 03:03:22","md"
"./web/flowith/governance_content.md.meta.json",249,"2025-11-29 02:49:22","json"
"./web/flowith/haderos_integration_strategy.md",15435,"2025-11-29 02:13:52","md"
"./web/flowith/code_content.md",37846,"2025-11-29 02:59:22","md"
"./web/flowith/final_pure_code_html.md.meta.json",373,"2025-11-29 04:01:53","json"
"./web/flowith/haderos_code_content.md",1164,"2025-11-29 03:02:22","md"
"./web/flowith/architecture.html.meta.json",289,"2025-11-29 03:51:23","json"
"./web/flowith/architecture.html",16987,"2025-11-29 03:51:23","html"
"./web/flowith/final_code_html.md.md.meta.json",371,"2025-11-29 03:03:22","json"
"./web/flowith/extracted_architecture_content.md.meta.json",319,"2025-11-29 02:27:22","json"
"./web/flowith/governance_content.md",42310,"2025-11-29 02:49:22","md"
"./web/flowith/haderos_project_components_analysis.md.meta.json",398,"2025-11-29 02:12:52","json"
"./web/flowith/extracted_architecture_content.md",106,"2025-11-29 02:27:22","md"
"./web/flowith/haderos_code_section.md.meta.json",251,"2025-11-29 03:01:22","json"
"./web/flowith/code_content.md.md.meta.json",378,"2025-11-29 02:55:52","json"
"./web/flowith/final_technical_specs_html.md.meta.json",379,"2025-11-29 02:43:04","json"
"./web/flowith/haderos_integration_strategy.md.meta.json",381,"2025-11-29 02:13:52","json"
"./web/flowith/index.html.meta.json",282,"2025-11-29 03:51:23","json"
"./web/flowith/clean_code_html.md.meta.json",368,"2025-11-29 03:06:52","json"
"./web/flowith/haderos_code_content.md.meta.json",251,"2025-11-29 03:02:22","json"
"./web/flowith/code_content_2025-11-29T01-01-31.md",8044,"2025-11-29 03:01:52","md"
"./web/flowith/technical_specs.html.meta.json",292,"2025-11-29 03:51:23","json"
"./web/flowith/technical_specs_extracted.md.md.meta.json",391,"2025-11-29 02:40:22","json"
"./web/flowith/technical_specs_extracted.md.md",3522,"2025-11-29 02:40:22","md"
"./web/flowith/haderos_project_hub/technical.html",7239,"2025-11-29 02:17:22","html"
"./web/flowith/haderos_project_hub/overview.html.meta.json",271,"2025-11-29 02:17:22","json"
"./web/flowith/haderos_project_hub/index.html",11997,"2025-11-29 02:17:22","html"
"./web/flowith/haderos_project_hub/governance.html.meta.json",275,"2025-11-29 02:17:22","json"
"./web/flowith/haderos_project_hub/governance.html",6984,"2025-11-29 02:17:22","html"
"./web/flowith/haderos_project_hub/technical.html.meta.json",273,"2025-11-29 02:17:22","json"
"./web/flowith/haderos_project_hub/overview.html",6860,"2025-11-29 02:17:22","html"
"./web/flowith/haderos_project_hub/resources.html",7053,"2025-11-29 02:17:22","html"
"./web/flowith/haderos_project_hub/index.html.meta.json",265,"2025-11-29 02:17:22","json"
"./web/flowith/haderos_project_hub/visuals.html.meta.json",269,"2025-11-29 02:17:22","json"
"./web/flowith/haderos_project_hub/visuals.html",7548,"2025-11-29 02:17:22","html"
"./web/flowith/haderos_project_hub/resources.html.meta.json",273,"2025-11-29 02:17:22","json"
"./web/flowith/haderos_project_hub/.preview_index.html",11997,"2025-11-29 02:17:32","html"
"./web/flowith/HADER_2030/.DS_Store",28676,"2025-11-22 22:20:22","DS_Store"
"./web/flowith/HADER_2030/03_Ù‡Ù†Ø¯Ø³Ø©_Ø§Ù„Ù…Ø¹Ø±ÙØ©/03-05_hka_kaia_haderos_integration.txt",5978,"2025-11-16 02:49:11","txt"
"./web/flowith/HADER_2030/03_Ù‡Ù†Ø¯Ø³Ø©_Ø§Ù„Ù…Ø¹Ø±ÙØ©/03-02_hka_knowledge_graph_spec.txt",6481,"2025-11-16 02:46:10","txt"
"./web/flowith/HADER_2030/03_Ù‡Ù†Ø¯Ø³Ø©_Ø§Ù„Ù…Ø¹Ø±ÙØ©/03-01_hka_blueprint.txt",2790,"2025-11-16 02:44:17","txt"
"./web/flowith/HADER_2030/03_Ù‡Ù†Ø¯Ø³Ø©_Ø§Ù„Ù…Ø¹Ø±ÙØ©/03-03_hka_reasoning_engine_spec.txt",5909,"2025-11-16 02:47:04","txt"
"./web/flowith/HADER_2030/03_Ù‡Ù†Ø¯Ø³Ø©_Ø§Ù„Ù…Ø¹Ø±ÙØ©/03-04_hader_product_structure_brief_v1_7_3.txt",6244,"2025-11-16 02:48:18","txt"
"./web/flowith/HADER_2030/02_Ø§Ù„ØªØ´ØºÙŠÙ„_ÙˆØ§Ù„Ù…Ø¤Ø´Ø±Ø§Øª/11_whatsapp_all_messages_meta.txt",1037,"2025-11-15 16:54:10","txt"
"./web/flowith/HADER_2030/02_Ø§Ù„ØªØ´ØºÙŠÙ„_ÙˆØ§Ù„Ù…Ø¤Ø´Ø±Ø§Øª/whatsapp_ALL_messages.csv",22436411,"2025-11-09 23:10:19","csv"
"./web/flowith/HADER_2030/02_Ø§Ù„ØªØ´ØºÙŠÙ„_ÙˆØ§Ù„Ù…Ø¤Ø´Ø±Ø§Øª/08_pop_footwear_costing.txt",776,"2025-11-15 16:50:37","txt"
"./web/flowith/HADER_2030/02_Ø§Ù„ØªØ´ØºÙŠÙ„_ÙˆØ§Ù„Ù…Ø¤Ø´Ø±Ø§Øª/whatsapp_last3days.txt",90,"2025-11-09 22:54:59","txt"
"./web/flowith/HADER_2030/02_Ø§Ù„ØªØ´ØºÙŠÙ„_ÙˆØ§Ù„Ù…Ø¤Ø´Ø±Ø§Øª/04_yawmiat_tahseelaat.txt",9083,"2025-11-16 02:06:53","txt"
"./web/flowith/HADER_2030/02_Ø§Ù„ØªØ´ØºÙŠÙ„_ÙˆØ§Ù„Ù…Ø¤Ø´Ø±Ø§Øª/14_taqreer_alhaykal_waltaaheel_2025.txt",1097,"2025-11-15 16:54:10","txt"
"./web/flowith/HADER_2030/02_Ø§Ù„ØªØ´ØºÙŠÙ„_ÙˆØ§Ù„Ù…Ø¤Ø´Ø±Ø§Øª/wa_last3days_sent.csv",98472,"2025-11-09 23:13:40","csv"
"./web/flowith/HADER_2030/02_Ø§Ù„ØªØ´ØºÙŠÙ„_ÙˆØ§Ù„Ù…Ø¤Ø´Ø±Ø§Øª/NOW_SHOES_EGYPT_VERIFICATION_PACK.pdf",4165,"2025-10-09 03:30:46","pdf"
"./web/flowith/HADER_2030/02_Ø§Ù„ØªØ´ØºÙŠÙ„_ÙˆØ§Ù„Ù…Ø¤Ø´Ø±Ø§Øª/13_wa_reports_index.txt",982,"2025-11-15 16:54:10","txt"
"./web/flowith/HADER_2030/02_Ø§Ù„ØªØ´ØºÙŠÙ„_ÙˆØ§Ù„Ù…Ø¤Ø´Ø±Ø§Øª/07_bazooka_orders_2025_04_198_full.md",8255,"2025-11-16 02:30:08","md"
"./web/flowith/HADER_2030/02_Ø§Ù„ØªØ´ØºÙŠÙ„_ÙˆØ§Ù„Ù…Ø¤Ø´Ø±Ø§Øª/05_reports_and_kpis.txt",4005,"2025-11-16 02:14:33","txt"
"./web/flowith/HADER_2030/02_Ø§Ù„ØªØ´ØºÙŠÙ„_ÙˆØ§Ù„Ù…Ø¤Ø´Ø±Ø§Øª/wa_last3days_all.csv",263556,"2025-11-09 23:13:40","csv"
"./web/flowith/HADER_2030/02_Ø§Ù„ØªØ´ØºÙŠÙ„_ÙˆØ§Ù„Ù…Ø¤Ø´Ø±Ø§Øª/ØªÙ‚Ø±ÙŠØ±_Ø§Ù„Ù‡ÙŠÙƒÙ„_ÙˆØ§Ù„ØªØ§Ù”Ù‡ÙŠÙ„_Ø§Ù„Ø¨Ø´Ø±ÙŠ_Ø­Ø§Ø¶Ø±_2025.xlsx",11117,"2025-10-09 02:29:37","xlsx"
"./web/flowith/HADER_2030/02_Ø§Ù„ØªØ´ØºÙŠÙ„_ÙˆØ§Ù„Ù…Ø¤Ø´Ø±Ø§Øª/10_wa_last3days_sent_meta.txt",1075,"2025-11-15 16:54:10","txt"
"./web/flowith/HADER_2030/02_Ø§Ù„ØªØ´ØºÙŠÙ„_ÙˆØ§Ù„Ù…Ø¤Ø´Ø±Ø§Øª/09_wa_last3days_all_meta.txt",1096,"2025-11-15 16:54:10","txt"
"./web/flowith/HADER_2030/02_Ø§Ù„ØªØ´ØºÙŠÙ„_ÙˆØ§Ù„Ù…Ø¤Ø´Ø±Ø§Øª/06_now_shoes_verification_pack.txt",1142,"2025-11-15 16:23:06","txt"
"./web/flowith/HADER_2030/02_Ø§Ù„ØªØ´ØºÙŠÙ„_ÙˆØ§Ù„Ù…Ø¤Ø´Ø±Ø§Øª/01_daily_operations_tracker.txt",21217,"2025-11-16 01:45:03","txt"
"./web/flowith/HADER_2030/02_Ø§Ù„ØªØ´ØºÙŠÙ„_ÙˆØ§Ù„Ù…Ø¤Ø´Ø±Ø§Øª/07_bazooka_orders_2025_04_198.txt",13784,"2025-11-16 02:28:14","txt"
"./web/flowith/HADER_2030/02_Ø§Ù„ØªØ´ØºÙŠÙ„_ÙˆØ§Ù„Ù…Ø¤Ø´Ø±Ø§Øª/whatsapp_ALL_messages.txt",23521057,"2025-11-09 23:10:19","txt"
"./web/flowith/HADER_2030/02_Ø§Ù„ØªØ´ØºÙŠÙ„_ÙˆØ§Ù„Ù…Ø¤Ø´Ø±Ø§Øª/wa_last3days_sent.txt",103694,"2025-11-09 23:13:40","txt"
"./web/flowith/HADER_2030/02_Ø§Ù„ØªØ´ØºÙŠÙ„_ÙˆØ§Ù„Ù…Ø¤Ø´Ø±Ø§Øª/09_whatsapp_data_sources.txt",1561,"2025-11-15 17:07:12","txt"
"./web/flowith/HADER_2030/02_Ø§Ù„ØªØ´ØºÙŠÙ„_ÙˆØ§Ù„Ù…Ø¤Ø´Ø±Ø§Øª/02_yawmiat_tasleemat.txt",7031,"2025-11-16 02:00:54","txt"
"./web/flowith/HADER_2030/02_Ø§Ù„ØªØ´ØºÙŠÙ„_ÙˆØ§Ù„Ù…Ø¤Ø´Ø±Ø§Øª/06_operational_costs_log.txt",14809,"2025-11-16 02:20:48","txt"
"./web/flowith/HADER_2030/02_Ø§Ù„ØªØ´ØºÙŠÙ„_ÙˆØ§Ù„Ù…Ø¤Ø´Ø±Ø§Øª/wa_reports/by_hour.csv",17,"2025-11-09 22:55:58","csv"
"./web/flowith/HADER_2030/02_Ø§Ù„ØªØ´ØºÙŠÙ„_ÙˆØ§Ù„Ù…Ø¤Ø´Ø±Ø§Øª/wa_reports/by_day.csv",11,"2025-11-09 22:55:58","csv"
"./web/flowith/HADER_2030/02_Ø§Ù„ØªØ´ØºÙŠÙ„_ÙˆØ§Ù„Ù…Ø¤Ø´Ø±Ø§Øª/wa_reports/top_words.csv",12,"2025-11-09 22:55:58","csv"
"./web/flowith/HADER_2030/02_Ø§Ù„ØªØ´ØºÙŠÙ„_ÙˆØ§Ù„Ù…Ø¤Ø´Ø±Ø§Øª/wa_reports/SUMMARY.txt",43,"2025-11-09 22:55:58","txt"
"./web/flowith/HADER_2030/02_Ø§Ù„ØªØ´ØºÙŠÙ„_ÙˆØ§Ù„Ù…Ø¤Ø´Ø±Ø§Øª/wa_reports/by_sender.csv",14,"2025-11-09 22:55:58","csv"
"./web/flowith/HADER_2030/02_Ø§Ù„ØªØ´ØºÙŠÙ„_ÙˆØ§Ù„Ù…Ø¤Ø´Ø±Ø§Øª/12_whatsapp_last3days_meta.txt",998,"2025-11-15 16:54:10","txt"
"./web/flowith/HADER_2030/02_Ø§Ù„ØªØ´ØºÙŠÙ„_ÙˆØ§Ù„Ù…Ø¤Ø´Ø±Ø§Øª/03_yawmiat_mortaga3at.txt",6715,"2025-11-16 02:01:53","txt"
"./web/flowith/HADER_2030/02_Ø§Ù„ØªØ´ØºÙŠÙ„_ÙˆØ§Ù„Ù…Ø¤Ø´Ø±Ø§Øª/wa_last3days_all.txt",290545,"2025-11-09 23:13:40","txt"
"./web/flowith/HADER_2030/WhatsApp Chat - Ø§Ù„Ø®Ø±ÙˆØ¬ ! ÙˆØ§Ù„ØªÙ‚Ø±ÙŠØ±.zip",6386325,"2025-11-16 02:32:42","zip"
"./web/flowith/HADER_2030/10_Ø§Ù„Ø³ÙŠØ§Ù‚_Ø§Ù„Ø­Ø¶Ø§Ø±ÙŠ_ÙˆØ§Ù„Ù‡ÙˆÙŠØ©/12_hader_system_integrated_analysis_2025-11.txt",2726,"2025-11-15 21:21:24","txt"
"./web/flowith/HADER_2030/06_Ø£ÙƒØ§Ø¯ÙŠÙ…ÙŠØ©_Ø­Ø§Ø¶Ø±_L1-L5/02_levels_L1_to_L5.txt",1081,"2025-11-15 16:58:54","txt"
"./web/flowith/HADER_2030/06_Ø£ÙƒØ§Ø¯ÙŠÙ…ÙŠØ©_Ø­Ø§Ø¶Ø±_L1-L5/02_leadership_path_tasks_bank.txt",1229,"2025-11-15 17:24:42","txt"
"./web/flowith/HADER_2030/06_Ø£ÙƒØ§Ø¯ÙŠÙ…ÙŠØ©_Ø­Ø§Ø¶Ø±_L1-L5/04_hre_and_kaia_in_leadership_evaluation.txt",1331,"2025-11-15 17:24:42","txt"
"./web/flowith/HADER_2030/06_Ø£ÙƒØ§Ø¯ÙŠÙ…ÙŠØ©_Ø­Ø§Ø¶Ø±_L1-L5/01_hader_academy_overview_L1_L5.txt",1367,"2025-11-15 17:24:42","txt"
"./web/flowith/HADER_2030/06_Ø£ÙƒØ§Ø¯ÙŠÙ…ÙŠØ©_Ø­Ø§Ø¶Ø±_L1-L5/04_task_bank_and_kpis.txt",1133,"2025-11-15 16:58:54","txt"
"./web/flowith/HADER_2030/06_Ø£ÙƒØ§Ø¯ÙŠÙ…ÙŠØ©_Ø­Ø§Ø¶Ø±_L1-L5/03_cell_of_9_equity.txt",1220,"2025-11-15 16:58:54","txt"
"./web/flowith/HADER_2030/06_Ø£ÙƒØ§Ø¯ÙŠÙ…ÙŠØ©_Ø­Ø§Ø¶Ø±_L1-L5/01_hader_academy_overview.txt",1080,"2025-11-15 16:58:54","txt"
"./web/flowith/HADER_2030/06_Ø£ÙƒØ§Ø¯ÙŠÙ…ÙŠØ©_Ø­Ø§Ø¶Ø±_L1-L5/03_cell_of_9_equity_promotion.txt",1266,"2025-11-15 17:24:42","txt"
"./web/flowith/HADER_2030/05_Ø§Ù„ØªÙˆØ§Ø¦Ù…_Ø§Ù„Ø±Ù‚Ù…ÙŠØ©_Digital_Twins/02_human_digital_twin_engine.txt",9120,"2025-11-17 13:53:01","txt"
"./web/flowith/HADER_2030/WhatsApp Chat - Ø§Ù„Ø®Ø±ÙˆØ¬ ! ÙˆØ§Ù„ØªÙ‚Ø±ÙŠØ±/00001441-Ø´ÙŠØª Ø®Ø±ÙˆØ¬ Ø§Ø´Ø­Ù†Ù„ÙŠ ÙŠÙˆÙ… 11-11-20225.xlsx",9351,"2025-11-12 00:59:42","xlsx"
"./web/flowith/HADER_2030/WhatsApp Chat - Ø§Ù„Ø®Ø±ÙˆØ¬ ! ÙˆØ§Ù„ØªÙ‚Ø±ÙŠØ±/00000214-PHOTO-2025-10-11-16-09-58.jpg",46854,"2025-10-11 16:09:58","jpg"
"./web/flowith/HADER_2030/WhatsApp Chat - Ø§Ù„Ø®Ø±ÙˆØ¬ ! ÙˆØ§Ù„ØªÙ‚Ø±ÙŠØ±/00000293-PHOTO-2025-10-12-12-19-40.jpg",75846,"2025-10-12 12:19:50","jpg"
"./web/flowith/HADER_2030/WhatsApp Chat - Ø§Ù„Ø®Ø±ÙˆØ¬ ! ÙˆØ§Ù„ØªÙ‚Ø±ÙŠØ±/00001362-Ø§Ù„Ø·Ø¨Ø§Ø¹Ù‡ 9-11-2025 (2).pdf",143407,"2025-11-09 17:04:58","pdf"
"./web/flowith/HADER_2030/WhatsApp Chat - Ø§Ù„Ø®Ø±ÙˆØ¬ ! ÙˆØ§Ù„ØªÙ‚Ø±ÙŠØ±/00000218-PHOTO-2025-10-11-16-11-34.jpg",46798,"2025-10-11 16:11:34","jpg"
"./web/flowith/HADER_2030/WhatsApp Chat - Ø§Ù„Ø®Ø±ÙˆØ¬ ! ÙˆØ§Ù„ØªÙ‚Ø±ÙŠØ±/00001380-PHOTO-2025-11-09-16-42-03.jpg",76841,"2025-11-09 17:04:48","jpg"
"./web/flowith/HADER_2030/WhatsApp Chat - Ø§Ù„Ø®Ø±ÙˆØ¬ ! ÙˆØ§Ù„ØªÙ‚Ø±ÙŠØ±/00000378-PHOTO-2025-10-14-13-36-44.jpg",135082,"2025-10-14 13:37:48","jpg"
"./web/flowith/HADER_2030/WhatsApp Chat - Ø§Ù„Ø®Ø±ÙˆØ¬ ! ÙˆØ§Ù„ØªÙ‚Ø±ÙŠØ±/00000164-PHOTO-2025-10-09-17-19-49.jpg",62316,"2025-10-09 17:19:48","jpg"
"./web/flowith/HADER_2030/WhatsApp Chat - Ø§Ù„Ø®Ø±ÙˆØ¬ ! ÙˆØ§Ù„ØªÙ‚Ø±ÙŠØ±/00000162-PHOTO-2025-10-09-17-19-12.jpg",72247,"2025-10-09 17:19:12","jpg"
"./web/flowith/HADER_2030/WhatsApp Chat - Ø§Ù„Ø®Ø±ÙˆØ¬ ! ÙˆØ§Ù„ØªÙ‚Ø±ÙŠØ±/00001423-Ø´ÙŠØª Ø®Ø±ÙˆØ¬ Ø§Ø´Ø­Ù†Ù„ÙŠ ÙŠÙˆÙ… 10-11-20225.xlsx",9646,"2025-11-10 16:13:42","xlsx"
"./web/flowith/HADER_2030/WhatsApp Chat - Ø§Ù„Ø®Ø±ÙˆØ¬ ! ÙˆØ§Ù„ØªÙ‚Ø±ÙŠØ±/00000825-Ø·Ø¨Ø§Ø¹Ù‡ 1.pdf",205708,"2025-10-25 16:09:36","pdf"
"./web/flowith/HADER_2030/WhatsApp Chat - Ø§Ù„Ø®Ø±ÙˆØ¬ ! ÙˆØ§Ù„ØªÙ‚Ø±ÙŠØ±/00001306-PHOTO-2025-11-08-11-15-57.jpg",67065,"2025-11-08 12:59:36","jpg"
"./web/flowith/HADER_2030/WhatsApp Chat - Ø§Ù„Ø®Ø±ÙˆØ¬ ! ÙˆØ§Ù„ØªÙ‚Ø±ÙŠØ±/00001451-Ø§Ù„Ø·Ø¨Ø§Ø¹Ù‡ 12-11-2025.pdf",143363,"2025-11-12 11:30:50","pdf"
"./web/flowith/HADER_2030/WhatsApp Chat - Ø§Ù„Ø®Ø±ÙˆØ¬ ! ÙˆØ§Ù„ØªÙ‚Ø±ÙŠØ±/00001419-Ø§Ù„Ø·Ø¨Ø§Ø¹Ù‡ 10-11-2025 (2).pdf",134569,"2025-11-10 14:48:28","pdf"
"./web/flowith/HADER_2030/WhatsApp Chat - Ø§Ù„Ø®Ø±ÙˆØ¬ ! ÙˆØ§Ù„ØªÙ‚Ø±ÙŠØ±/00000219-PHOTO-2025-10-11-16-11-42.jpg",45682,"2025-10-11 16:11:42","jpg"
"./web/flowith/HADER_2030/WhatsApp Chat - Ø§Ù„Ø®Ø±ÙˆØ¬ ! ÙˆØ§Ù„ØªÙ‚Ø±ÙŠØ±/00001316-Ø§Ù„Ø·Ø¨Ø§Ø¹Ù‡ 8-11-2025 (1).pdf",133678,"2025-11-08 12:59:36","pdf"
"./web/flowith/HADER_2030/WhatsApp Chat - Ø§Ù„Ø®Ø±ÙˆØ¬ ! ÙˆØ§Ù„ØªÙ‚Ø±ÙŠØ±/00001357-PHOTO-2025-11-09-13-25-09.jpg",116553,"2025-11-09 13:42:44","jpg"
"./web/flowith/HADER_2030/WhatsApp Chat - Ø§Ù„Ø®Ø±ÙˆØ¬ ! ÙˆØ§Ù„ØªÙ‚Ø±ÙŠØ±/00000022-PHOTO-2025-10-05-18-41-16.jpg",43095,"2025-10-05 18:41:16","jpg"
"./web/flowith/HADER_2030/WhatsApp Chat - Ø§Ù„Ø®Ø±ÙˆØ¬ ! ÙˆØ§Ù„ØªÙ‚Ø±ÙŠØ±/00001402-Ø§Ù„Ø·Ø¨Ø§Ø¹Ø© 10-11-2025 (1).pdf",106077,"2025-11-10 12:22:02","pdf"
"./web/flowith/HADER_2030/WhatsApp Chat - Ø§Ù„Ø®Ø±ÙˆØ¬ ! ÙˆØ§Ù„ØªÙ‚Ø±ÙŠØ±/00000565-Ø®Ø±ÙˆØ¬ Ø¬ÙŠ ØªÙŠ 18-10-2025.xlsx",17834,"2025-10-18 21:37:48","xlsx"
"./web/flowith/HADER_2030/WhatsApp Chat - Ø§Ù„Ø®Ø±ÙˆØ¬ ! ÙˆØ§Ù„ØªÙ‚Ø±ÙŠØ±/00001367-PHOTO-2025-11-09-16-16-02.jpg",167755,"2025-11-09 17:05:00","jpg"
"./web/flowith/HADER_2030/WhatsApp Chat - Ø§Ù„Ø®Ø±ÙˆØ¬ ! ÙˆØ§Ù„ØªÙ‚Ø±ÙŠØ±/00000897-PHOTO-2025-10-26-16-21-41.jpg",109646,"2025-10-26 16:21:42","jpg"
"./web/flowith/HADER_2030/WhatsApp Chat - Ø§Ù„Ø®Ø±ÙˆØ¬ ! ÙˆØ§Ù„ØªÙ‚Ø±ÙŠØ±/00000915-PHOTO-2025-10-27-01-06-05.jpg",67934,"2025-10-27 01:12:18","jpg"
"./web/flowith/HADER_2030/WhatsApp Chat - Ø§Ù„Ø®Ø±ÙˆØ¬ ! ÙˆØ§Ù„ØªÙ‚Ø±ÙŠØ±/00001384-PHOTO-2025-11-09-17-11-24.jpg",188072,"2025-11-09 17:11:24","jpg"
"./web/flowith/HADER_2030/WhatsApp Chat - Ø§Ù„Ø®Ø±ÙˆØ¬ ! ÙˆØ§Ù„ØªÙ‚Ø±ÙŠØ±/00000845-Ø®Ø±ÙˆØ¬ Ø§Ø´Ø­Ù†Ù„ÙŠ 25.10.2025.xlsx",10617,"2025-10-25 16:07:10","xlsx"
"./web/flowith/HADER_2030/WhatsApp Chat - Ø§Ù„Ø®Ø±ÙˆØ¬ ! ÙˆØ§Ù„ØªÙ‚Ø±ÙŠØ±/00001333-PHOTO-2025-11-08-16-06-59.jpg",95376,"2025-11-08 16:06:58","jpg"
"./web/flowith/HADER_2030/WhatsApp Chat - Ø§Ù„Ø®Ø±ÙˆØ¬ ! ÙˆØ§Ù„ØªÙ‚Ø±ÙŠØ±/00000224-PHOTO-2025-10-11-16-26-04.jpg",89756,"2025-10-11 16:26:04","jpg"
"./web/flowith/HADER_2030/WhatsApp Chat - Ø§Ù„Ø®Ø±ÙˆØ¬ ! ÙˆØ§Ù„ØªÙ‚Ø±ÙŠØ±/00001320-PHOTO-2025-11-08-12-57-28.jpg",87175,"2025-11-08 12:59:34","jpg"
"./web/flowith/HADER_2030/WhatsApp Chat - Ø§Ù„Ø®Ø±ÙˆØ¬ ! ÙˆØ§Ù„ØªÙ‚Ø±ÙŠØ±/00000848-PHOTO-2025-10-25-16-10-52.jpg",72173,"2025-10-25 16:10:52","jpg"
"./web/flowith/HADER_2030/WhatsApp Chat - Ø§Ù„Ø®Ø±ÙˆØ¬ ! ÙˆØ§Ù„ØªÙ‚Ø±ÙŠØ±/00001311-PHOTO-2025-11-08-11-58-30.jpg",118993,"2025-11-08 12:59:36","jpg"
"./web/flowith/HADER_2030/WhatsApp Chat - Ø§Ù„Ø®Ø±ÙˆØ¬ ! ÙˆØ§Ù„ØªÙ‚Ø±ÙŠØ±/00000230-PHOTO-2025-10-11-16-37-14.jpg",63400,"2025-10-11 16:37:14","jpg"
"./web/flowith/HADER_2030/WhatsApp Chat - Ø§Ù„Ø®Ø±ÙˆØ¬ ! ÙˆØ§Ù„ØªÙ‚Ø±ÙŠØ±/00000153-PHOTO-2025-10-09-11-46-55.jpg",47221,"2025-10-09 11:47:04","jpg"
"./web/flowith/HADER_2030/WhatsApp Chat - Ø§Ù„Ø®Ø±ÙˆØ¬ ! ÙˆØ§Ù„ØªÙ‚Ø±ÙŠØ±/00000255-Ø¨ÙŠÙƒ Ø§Ø¨ Ø§Ø´Ø­Ù†Ù„ÙŠ ÙŠÙˆÙ… 11-10-2025.xlsx",9632,"2025-10-11 17:24:20","xlsx"
"./web/flowith/HADER_2030/WhatsApp Chat - Ø§Ù„Ø®Ø±ÙˆØ¬ ! ÙˆØ§Ù„ØªÙ‚Ø±ÙŠØ±/00001379-Ø´ÙŠØª Ø®Ø±ÙˆØ¬ Ø§Ø´Ø­Ù†Ù„ÙŠ 9-11-2025.xlsx",10656,"2025-11-09 17:04:44","xlsx"
"./web/flowith/HADER_2030/WhatsApp Chat - Ø§Ù„Ø®Ø±ÙˆØ¬ ! ÙˆØ§Ù„ØªÙ‚Ø±ÙŠØ±/00001394-oneorder-mnfeen-9-11.pdf",79858,"2025-11-09 17:05:00","pdf"
"./web/flowith/HADER_2030/WhatsApp Chat - Ø§Ù„Ø®Ø±ÙˆØ¬ ! ÙˆØ§Ù„ØªÙ‚Ø±ÙŠØ±/00001339-PHOTO-2025-11-08-16-44-11.jpg",153554,"2025-11-08 16:44:10","jpg"
"./web/flowith/HADER_2030/WhatsApp Chat - Ø§Ù„Ø®Ø±ÙˆØ¬ ! ÙˆØ§Ù„ØªÙ‚Ø±ÙŠØ±/00001411-PHOTO-2025-11-10-14-03-34.jpg",102736,"2025-11-10 14:03:34","jpg"
"./web/flowith/HADER_2030/WhatsApp Chat - Ø§Ù„Ø®Ø±ÙˆØ¬ ! ÙˆØ§Ù„ØªÙ‚Ø±ÙŠØ±/00001473-Ø´ÙŠØª Ø®Ø±ÙˆØ¬ Ø§Ø´Ø­Ù†Ù„ÙŠ ÙŠÙˆÙ… 12-11-2025.xlsx",9898,"2025-11-12 16:14:08","xlsx"
"./web/flowith/HADER_2030/WhatsApp Chat - Ø§Ù„Ø®Ø±ÙˆØ¬ ! ÙˆØ§Ù„ØªÙ‚Ø±ÙŠØ±/00001478-PHOTO-2025-11-12-16-44-23.jpg",173826,"2025-11-12 16:44:22","jpg"
"./web/flowith/HADER_2030/WhatsApp Chat - Ø§Ù„Ø®Ø±ÙˆØ¬ ! ÙˆØ§Ù„ØªÙ‚Ø±ÙŠØ±/00000914-Ø´ÙŠØª Ø®Ø±ÙˆØ¬ Ø¬ÙŠ ØªÙŠ ÙŠÙˆÙ… 26-10-2025.xlsx",15325,"2025-10-26 16:51:30","xlsx"
"./web/flowith/HADER_2030/WhatsApp Chat - Ø§Ù„Ø®Ø±ÙˆØ¬ ! ÙˆØ§Ù„ØªÙ‚Ø±ÙŠØ±/00000037-PHOTO-2025-10-06-12-42-55.jpg",250249,"2025-10-06 12:42:56","jpg"
"./web/flowith/HADER_2030/WhatsApp Chat - Ø§Ù„Ø®Ø±ÙˆØ¬ ! ÙˆØ§Ù„ØªÙ‚Ø±ÙŠØ±/00000831-PHOTO-2025-10-25-11-10-23.jpg",43331,"2025-10-25 14:09:14","jpg"
"./web/flowith/HADER_2030/WhatsApp Chat - Ø§Ù„Ø®Ø±ÙˆØ¬ ! ÙˆØ§Ù„ØªÙ‚Ø±ÙŠØ±/00000832-PHOTO-2025-10-25-11-17-18.jpg",57029,"2025-10-25 14:09:14","jpg"
"./web/flowith/HADER_2030/WhatsApp Chat - Ø§Ù„Ø®Ø±ÙˆØ¬ ! ÙˆØ§Ù„ØªÙ‚Ø±ÙŠØ±/00000188-PHOTO-2025-10-11-11-49-33.jpg",64199,"2025-10-11 11:49:32","jpg"
"./web/flowith/HADER_2030/WhatsApp Chat - Ø§Ù„Ø®Ø±ÙˆØ¬ ! ÙˆØ§Ù„ØªÙ‚Ø±ÙŠØ±/00001348-PHOTO-2025-11-09-11-08-52.jpg",56089,"2025-11-09 13:44:56","jpg"
"./web/flowith/HADER_2030/WhatsApp Chat - Ø§Ù„Ø®Ø±ÙˆØ¬ ! ÙˆØ§Ù„ØªÙ‚Ø±ÙŠØ±/00000882-Ø§Ù„Ø·Ø¨Ø§Ø¹Ù‡ Ø´ÙŠØª 1.pdf",143266,"2025-10-26 12:18:28","pdf"
"./web/flowith/HADER_2030/WhatsApp Chat - Ø§Ù„Ø®Ø±ÙˆØ¬ ! ÙˆØ§Ù„ØªÙ‚Ø±ÙŠØ±/00000836-Ø·Ø¨Ø§Ø¹Ù‡ 25.10- 2.pdf",107306,"2025-10-25 14:09:12","pdf"
"./web/flowith/HADER_2030/WhatsApp Chat - Ø§Ù„Ø®Ø±ÙˆØ¬ ! ÙˆØ§Ù„ØªÙ‚Ø±ÙŠØ±/00001340-PHOTO-2025-11-08-16-44-31.jpg",147879,"2025-11-08 16:44:32","jpg"
"./web/flowith/HADER_2030/WhatsApp Chat - Ø§Ù„Ø®Ø±ÙˆØ¬ ! ÙˆØ§Ù„ØªÙ‚Ø±ÙŠØ±/00000163-PHOTO-2025-10-09-17-19-32.jpg",73254,"2025-10-09 17:19:32","jpg"
"./web/flowith/HADER_2030/WhatsApp Chat - Ø§Ù„Ø®Ø±ÙˆØ¬ ! ÙˆØ§Ù„ØªÙ‚Ø±ÙŠØ±/00001456-Ø§Ù„Ø·Ø¨Ø§Ø¹Ø© 12-11-2025 (2).pdf",160057,"2025-11-12 13:57:00","pdf"
"./web/flowith/HADER_2030/WhatsApp Chat - Ø§Ù„Ø®Ø±ÙˆØ¬ ! ÙˆØ§Ù„ØªÙ‚Ø±ÙŠØ±/00000356-Ø®Ø±ÙˆØ¬ Ø§Ø´Ø­Ù†Ù„ÙŠ 13.10.2025.xlsx",8370,"2025-10-13 17:33:44","xlsx"
"./web/flowith/HADER_2030/WhatsApp Chat - Ø§Ù„Ø®Ø±ÙˆØ¬ ! ÙˆØ§Ù„ØªÙ‚Ø±ÙŠØ±/00001439-Ø´ÙŠØª Ø®Ø±ÙˆØ¬ ÙŠÙˆÙ… 11Ø¬ÙŠ ØªÙŠ.xlsx",13050,"2025-11-12 00:59:42","xlsx"
"./web/flowith/HADER_2030/WhatsApp Chat - Ø§Ù„Ø®Ø±ÙˆØ¬ ! ÙˆØ§Ù„ØªÙ‚Ø±ÙŠØ±/00001457-PHOTO-2025-11-12-14-20-31.jpg",90897,"2025-11-12 14:20:32","jpg"
"./web/flowith/HADER_2030/WhatsApp Chat - Ø§Ù„Ø®Ø±ÙˆØ¬ ! ÙˆØ§Ù„ØªÙ‚Ø±ÙŠØ±/00000913-Ø´ÙŠØª Ø®Ø±ÙˆØ¬ Ø§Ø´Ø­Ù†Ù„ÙŠ ÙŠÙˆÙ… 26-10-2025.xlsx",12145,"2025-10-26 16:50:56","xlsx"
"./web/flowith/HADER_2030/WhatsApp Chat - Ø§Ù„Ø®Ø±ÙˆØ¬ ! ÙˆØ§Ù„ØªÙ‚Ø±ÙŠØ±/00000148-PHOTO-2025-10-09-11-29-24.jpg",92702,"2025-10-09 11:29:24","jpg"
"./web/flowith/HADER_2030/WhatsApp Chat - Ø§Ù„Ø®Ø±ÙˆØ¬ ! ÙˆØ§Ù„ØªÙ‚Ø±ÙŠØ±/00000905-PHOTO-2025-10-26-16-36-48.jpg",87381,"2025-10-26 16:36:48","jpg"
"./web/flowith/HADER_2030/WhatsApp Chat - Ø§Ù„Ø®Ø±ÙˆØ¬ ! ÙˆØ§Ù„ØªÙ‚Ø±ÙŠØ±/00000131-Ø®Ø±ÙˆØ¬ Ø¬ÙŠ ØªÙŠ ÙŠÙˆÙ… 8-10-2025.xlsx",16343,"2025-10-08 20:23:12","xlsx"
"./web/flowith/HADER_2030/WhatsApp Chat - Ø§Ù„Ø®Ø±ÙˆØ¬ ! ÙˆØ§Ù„ØªÙ‚Ø±ÙŠØ±/00000123-PHOTO-2025-10-08-16-57-22.jpg",76695,"2025-10-08 20:12:12","jpg"
"./web/flowith/HADER_2030/WhatsApp Chat - Ø§Ù„Ø®Ø±ÙˆØ¬ ! ÙˆØ§Ù„ØªÙ‚Ø±ÙŠØ±/00001341-PHOTO-2025-11-08-16-45-01.jpg",158661,"2025-11-08 16:45:00","jpg"
"./web/flowith/HADER_2030/WhatsApp Chat - Ø§Ù„Ø®Ø±ÙˆØ¬ ! ÙˆØ§Ù„ØªÙ‚Ø±ÙŠØ±/00000336-PHOTO-2025-10-13-12-01-28.jpg",49284,"2025-10-13 12:01:28","jpg"
"./web/flowith/HADER_2030/WhatsApp Chat - Ø§Ù„Ø®Ø±ÙˆØ¬ ! ÙˆØ§Ù„ØªÙ‚Ø±ÙŠØ±/00000039-PHOTO-2025-10-06-12-47-26.jpg",221187,"2025-10-06 12:47:26","jpg"
"./web/flowith/HADER_2030/WhatsApp Chat - Ø§Ù„Ø®Ø±ÙˆØ¬ ! ÙˆØ§Ù„ØªÙ‚Ø±ÙŠØ±/00001472-Ø·Ø¨Ø§Ø¹Ø©.pdf",42976,"2025-11-12 16:12:16","pdf"
"./web/flowith/HADER_2030/WhatsApp Chat - Ø§Ù„Ø®Ø±ÙˆØ¬ ! ÙˆØ§Ù„ØªÙ‚Ø±ÙŠØ±/00001369-STICKER-2025-11-09-16-21-07.webp",12306,"2025-11-09 13:44:56","webp"
"./web/flowith/HADER_2030/WhatsApp Chat - Ø§Ù„Ø®Ø±ÙˆØ¬ ! ÙˆØ§Ù„ØªÙ‚Ø±ÙŠØ±/00000034-PHOTO-2025-10-06-12-33-52.jpg",43111,"2025-10-06 12:42:26","jpg"
"./web/flowith/HADER_2030/WhatsApp Chat - Ø§Ù„Ø®Ø±ÙˆØ¬ ! ÙˆØ§Ù„ØªÙ‚Ø±ÙŠØ±/00000215-PHOTO-2025-10-11-16-10-11.jpg",48492,"2025-10-11 16:10:10","jpg"
"./web/flowith/HADER_2030/WhatsApp Chat - Ø§Ù„Ø®Ø±ÙˆØ¬ ! ÙˆØ§Ù„ØªÙ‚Ø±ÙŠØ±/_chat.txt",292007,"2025-11-16 02:32:40","txt"
"./web/flowith/HADER_2030/WhatsApp Chat - Ø§Ù„Ø®Ø±ÙˆØ¬ ! ÙˆØ§Ù„ØªÙ‚Ø±ÙŠØ±/00000187-PHOTO-2025-10-11-11-33-43.jpg",64076,"2025-10-11 11:34:16","jpg"
"./web/flowith/HADER_2030/WhatsApp Chat - Ø§Ù„Ø®Ø±ÙˆØ¬ ! ÙˆØ§Ù„ØªÙ‚Ø±ÙŠØ±/00000846-Ø´ÙŠØª Ø§Ù„Ø®Ø±ÙˆØ¬ Ø¬ÙŠ ØªÙŠ 25.10.2025.xlsx",20903,"2025-10-25 16:07:18","xlsx"
"./web/flowith/HADER_2030/WhatsApp Chat - Ø§Ù„Ø®Ø±ÙˆØ¬ ! ÙˆØ§Ù„ØªÙ‚Ø±ÙŠØ±/00000217-PHOTO-2025-10-11-16-11-16.jpg",43525,"2025-10-11 16:11:16","jpg"
"./web/flowith/HADER_2030/WhatsApp Chat - Ø§Ù„Ø®Ø±ÙˆØ¬ ! ÙˆØ§Ù„ØªÙ‚Ø±ÙŠØ±/00000189-PHOTO-2025-10-11-12-00-19.jpg",78209,"2025-10-11 12:00:20","jpg"
"./web/flowith/HADER_2030/WhatsApp Chat - Ø§Ù„Ø®Ø±ÙˆØ¬ ! ÙˆØ§Ù„ØªÙ‚Ø±ÙŠØ±/00000161-PHOTO-2025-10-09-17-18-56.jpg",61657,"2025-10-09 17:18:56","jpg"
"./web/flowith/HADER_2030/WhatsApp Chat - Ø§Ù„Ø®Ø±ÙˆØ¬ ! ÙˆØ§Ù„ØªÙ‚Ø±ÙŠØ±/00000345-PHOTO-2025-10-13-13-01-40.jpg",56784,"2025-10-13 13:01:40","jpg"
"./web/flowith/HADER_2030/WhatsApp Chat - Ø§Ù„Ø®Ø±ÙˆØ¬ ! ÙˆØ§Ù„ØªÙ‚Ø±ÙŠØ±/00001336-Ø´ÙŠØª Ø®Ø±ÙˆØ¬ Ø¬ÙŠ ØªÙŠ ÙŠÙˆÙ… 8-11-2025.xlsx",18561,"2025-11-08 16:14:56","xlsx"
"./web/flowith/HADER_2030/WhatsApp Chat - Ø§Ù„Ø®Ø±ÙˆØ¬ ! ÙˆØ§Ù„ØªÙ‚Ø±ÙŠØ±/00000895-Ø§Ù„Ø·Ø¨Ø§Ø¹Ù‡ Ø´ÙŠØª 2.pdf",183590,"2025-10-26 15:08:12","pdf"
"./web/flowith/HADER_2030/WhatsApp Chat - Ø§Ù„Ø®Ø±ÙˆØ¬ ! ÙˆØ§Ù„ØªÙ‚Ø±ÙŠØ±/00000177-PHOTO-2025-10-11-10-59-33.jpg",113312,"2025-10-11 11:00:16","jpg"
"./web/flowith/HADER_2030/WhatsApp Chat - Ø§Ù„Ø®Ø±ÙˆØ¬ ! ÙˆØ§Ù„ØªÙ‚Ø±ÙŠØ±/00000306-PHOTO-2025-10-12-14-23-27.jpg",48526,"2025-10-12 14:23:36","jpg"
"./web/flowith/HADER_2030/WhatsApp Chat - Ø§Ù„Ø®Ø±ÙˆØ¬ ! ÙˆØ§Ù„ØªÙ‚Ø±ÙŠØ±/00000127-PHOTO-2025-10-08-17-04-58.jpg",112853,"2025-10-08 20:35:24","jpg"
"./web/flowith/HADER_2030/WhatsApp Chat - Ø§Ù„Ø®Ø±ÙˆØ¬ ! ÙˆØ§Ù„ØªÙ‚Ø±ÙŠØ±/00000216-PHOTO-2025-10-11-16-10-24.jpg",40963,"2025-10-11 16:10:24","jpg"
"./web/flowith/HADER_2030/WhatsApp Chat - Ø§Ù„Ø®Ø±ÙˆØ¬ ! ÙˆØ§Ù„ØªÙ‚Ø±ÙŠØ±/00001350-PHOTO-2025-11-09-11-09-09.jpg",62889,"2025-11-09 13:42:50","jpg"
"./web/flowith/HADER_2030/WhatsApp Chat - Ø§Ù„Ø®Ø±ÙˆØ¬ ! ÙˆØ§Ù„ØªÙ‚Ø±ÙŠØ±/00001392-Ø´ÙŠØª Ø®Ø±ÙˆØ¬ Ø¬ÙŠ ØªÙŠ 9-11-2025.xlsx",16902,"2025-11-09 17:18:12","xlsx"
"./web/flowith/HADER_2030/WhatsApp Chat - Ø§Ù„Ø®Ø±ÙˆØ¬ ! ÙˆØ§Ù„ØªÙ‚Ø±ÙŠØ±/00001337-Ø´ÙŠØª Ø®Ø±ÙˆØ¬ Ø§Ø´Ø­Ù†Ù„ÙŠ ÙŠÙˆÙ… 8-11-2025.xlsx",9868,"2025-11-08 16:15:08","xlsx"
"./web/flowith/HADER_2030/WhatsApp Chat - Ø§Ù„Ø®Ø±ÙˆØ¬ ! ÙˆØ§Ù„ØªÙ‚Ø±ÙŠØ±/00001435-Ø·Ø¨Ø§Ø¹Ù‡ 11.11.2025.pdf",143298,"2025-11-12 01:11:20","pdf"
"./web/flowith/HADER_2030/WhatsApp Chat - Ø§Ù„Ø®Ø±ÙˆØ¬ ! ÙˆØ§Ù„ØªÙ‚Ø±ÙŠØ±/00000321-Ø´ÙŠØª Ø®Ø±ÙˆØ¬ Ø¬ÙŠ ØªÙŠ 12-10-2025.xlsx",15692,"2025-10-12 18:00:04","xlsx"
"./web/flowith/HADER_2030/WhatsApp Chat - Ø§Ù„Ø®Ø±ÙˆØ¬ ! ÙˆØ§Ù„ØªÙ‚Ø±ÙŠØ±/00001346-Ø·Ø¨Ø§Ø¹Ù‡ 9-11-2025(1).pdf",133334,"2025-11-09 13:45:14","pdf"
"./web/flowith/HADER_2030/WhatsApp Chat - Ø§Ù„Ø®Ø±ÙˆØ¬ ! ÙˆØ§Ù„ØªÙ‚Ø±ÙŠØ±/00000075-Ø´ÙŠØª Ø®Ø±ÙˆØ¬ J&T ÙŠÙˆÙ… 6-10-2025.xlsx",16188,"2025-10-06 17:00:20","xlsx"
"./web/flowith/HADER_2030/WhatsApp Chat - Ø§Ù„Ø®Ø±ÙˆØ¬ ! ÙˆØ§Ù„ØªÙ‚Ø±ÙŠØ±/00000843-Ø·Ø¨Ø§Ø¹Ù‡ 25.10-3.pdf",125915,"2025-10-25 15:31:32","pdf"
"./web/flowith/HADER_2030/WhatsApp Chat - Ø§Ù„Ø®Ø±ÙˆØ¬ ! ÙˆØ§Ù„ØªÙ‚Ø±ÙŠØ±/00000357-Ø®Ø±ÙˆØ¬ Ø¬ÙŠ ØªÙŠ 13.10.2025.xlsx",10547,"2025-10-13 17:50:08","xlsx"
"./web/flowith/HADER_2030/WhatsApp Chat - Ø§Ù„Ø®Ø±ÙˆØ¬ ! ÙˆØ§Ù„ØªÙ‚Ø±ÙŠØ±/00001474-Ø´ÙŠØª Ø®Ø±ÙˆØ¬ Ø¬ÙŠ ØªÙŠ ÙŠÙˆÙ… 12-11-2025.xlsx",15455,"2025-11-12 16:14:18","xlsx"
"./web/flowith/HADER_2030/WhatsApp Chat - Ø§Ù„Ø®Ø±ÙˆØ¬ ! ÙˆØ§Ù„ØªÙ‚Ø±ÙŠØ±/00001426-Ø´ÙŠØª Ø®Ø±ÙˆØ¬ Ø¬ÙŠ ØªÙŠ ÙŠÙˆÙ… 10-11-2025.xlsx",16348,"2025-11-10 16:37:34","xlsx"
"./web/flowith/HADER_2030/08_Ø§Ù„ØªØ³ÙˆÙŠÙ‚_ÙˆØ§Ù„Ø¥Ø¹Ù„Ø§Ù…/01_campaign_elle_3amlooh_b2edena_template.txt",1257,"2025-11-15 17:19:12","txt"
"./web/flowith/HADER_2030/08_Ø§Ù„ØªØ³ÙˆÙŠÙ‚_ÙˆØ§Ù„Ø¥Ø¹Ù„Ø§Ù…/06_makc_report_md_meta.txt",1112,"2025-11-15 17:19:12","txt"
"./web/flowith/HADER_2030/08_Ø§Ù„ØªØ³ÙˆÙŠÙ‚_ÙˆØ§Ù„Ø¥Ø¹Ù„Ø§Ù…/02_campaign_elle_3amlooh_b2edena_production_book.txt",1164,"2025-11-15 17:19:12","txt"
"./web/flowith/HADER_2030/08_Ø§Ù„ØªØ³ÙˆÙŠÙ‚_ÙˆØ§Ù„Ø¥Ø¹Ù„Ø§Ù…/04_makc_ads_csv_meta.txt",1116,"2025-11-15 17:19:12","txt"
"./web/flowith/HADER_2030/08_Ø§Ù„ØªØ³ÙˆÙŠÙ‚_ÙˆØ§Ù„Ø¥Ø¹Ù„Ø§Ù…/05_makc_plan_md_meta.txt",1062,"2025-11-15 17:19:12","txt"
"./web/flowith/HADER_2030/08_Ø§Ù„ØªØ³ÙˆÙŠÙ‚_ÙˆØ§Ù„Ø¥Ø¹Ù„Ø§Ù…/03_hader_project_card_overview.txt",1141,"2025-11-15 17:19:12","txt"
"./web/flowith/HADER_2030/05_Ø§Ù„ÙˆÙƒÙ„Ø§Ø¡_KAIA_MAKC/04_kaia_al_himma_agent.txt",1142,"2025-11-15 16:58:01","txt"
"./web/flowith/HADER_2030/05_Ø§Ù„ÙˆÙƒÙ„Ø§Ø¡_KAIA_MAKC/02_kaia_al_asas_agent.txt",1123,"2025-11-15 16:58:01","txt"
"./web/flowith/HADER_2030/05_Ø§Ù„ÙˆÙƒÙ„Ø§Ø¡_KAIA_MAKC/03_kaia_al_itqan_agent.txt",1141,"2025-11-15 16:58:01","txt"
"./web/flowith/HADER_2030/05_Ø§Ù„ÙˆÙƒÙ„Ø§Ø¡_KAIA_MAKC/03_kaia_factory_and_logistics_agents.txt",1328,"2025-11-15 17:24:34","txt"
"./web/flowith/HADER_2030/05_Ø§Ù„ÙˆÙƒÙ„Ø§Ø¡_KAIA_MAKC/05_makc_overview.txt",1177,"2025-11-15 16:58:01","txt"
"./web/flowith/HADER_2030/05_Ø§Ù„ÙˆÙƒÙ„Ø§Ø¡_KAIA_MAKC/02_makc_overview.txt",1365,"2025-11-15 17:24:34","txt"
"./web/flowith/HADER_2030/05_Ø§Ù„ÙˆÙƒÙ„Ø§Ø¡_KAIA_MAKC/01_kaia_overview.txt",1417,"2025-11-15 17:24:34","txt"
"./web/flowith/HADER_2030/07_ÙƒÙŠÙ…ÙŠØª_ÙˆØ§Ù„Ù…Ù†ØªØ¬Ø§Øª_Ø§Ù„Ø§Ø¨ØªÙƒØ§Ø±ÙŠØ©/06_pop_catalogue_all_models.txt",1200,"2025-11-15 17:18:49","txt"
"./web/flowith/HADER_2030/07_ÙƒÙŠÙ…ÙŠØª_ÙˆØ§Ù„Ù…Ù†ØªØ¬Ø§Øª_Ø§Ù„Ø§Ø¨ØªÙƒØ§Ø±ÙŠØ©/03_product_M01_filter_wadi_al_naqaa.txt",1234,"2025-11-15 17:18:49","txt"
"./web/flowith/HADER_2030/07_ÙƒÙŠÙ…ÙŠØª_ÙˆØ§Ù„Ù…Ù†ØªØ¬Ø§Øª_Ø§Ù„Ø§Ø¨ØªÙƒØ§Ø±ÙŠØ©/01_kemit_overview.txt",1253,"2025-11-15 17:18:49","txt"
"./web/flowith/HADER_2030/07_ÙƒÙŠÙ…ÙŠØª_ÙˆØ§Ù„Ù…Ù†ØªØ¬Ø§Øª_Ø§Ù„Ø§Ø¨ØªÙƒØ§Ø±ÙŠØ©/04_product_M03_pottery_solar_cooler.txt",1285,"2025-11-15 17:18:49","txt"
"./web/flowith/HADER_2030/07_ÙƒÙŠÙ…ÙŠØª_ÙˆØ§Ù„Ù…Ù†ØªØ¬Ø§Øª_Ø§Ù„Ø§Ø¨ØªÙƒØ§Ø±ÙŠØ©/05_product_B01_toba_khbari.txt",1257,"2025-11-15 17:18:49","txt"
"./web/flowith/HADER_2030/07_ÙƒÙŠÙ…ÙŠØª_ÙˆØ§Ù„Ù…Ù†ØªØ¬Ø§Øª_Ø§Ù„Ø§Ø¨ØªÙƒØ§Ø±ÙŠØ©/02_method_70_30.txt",1208,"2025-11-15 17:18:49","txt"
"./web/flowith/HADER_2030/09_Ø§Ù„Ø§Ø³ØªØ«Ù…Ø§Ø±_ÙˆØ§Ù„ØªÙ…ÙˆÙŠÙ„/02_investment_funds_learning_series.txt",1312,"2025-11-15 17:15:39","txt"
"./web/flowith/HADER_2030/09_Ø§Ù„Ø§Ø³ØªØ«Ù…Ø§Ø±_ÙˆØ§Ù„ØªÙ…ÙˆÙŠÙ„/03_hader_financing_philosophy_equity_based.txt",1185,"2025-11-15 17:15:39","txt"
"./web/flowith/HADER_2030/09_Ø§Ù„Ø§Ø³ØªØ«Ù…Ø§Ø±_ÙˆØ§Ù„ØªÙ…ÙˆÙŠÙ„/01_hader_ebs_financial_220425.txt",1202,"2025-11-15 17:15:39","txt"
"./web/flowith/HADER_2030/manus/hader-telegram-bot-plan Ù¢.md",54696,"2025-11-17 22:11:00","md"
"./web/flowith/HADER_2030/manus/.DS_Store",12292,"2025-11-22 22:15:24","DS_Store"
"./web/flowith/HADER_2030/manus/hader-knowledge_delivery_v0.2.zip",5651589,"2025-11-17 21:00:51","zip"
"./web/flowith/HADER_2030/manus/hader-knowledge_delivery_v0.1.zip",5559945,"2025-11-17 20:27:10","zip"
"./web/flowith/HADER_2030/manus/haderos-dashboard.zip",36560,"2025-11-19 19:29:26","zip"
"./web/flowith/HADER_2030/manus/ai_studio_code.txt",3107,"2025-11-19 19:28:49","txt"
"./web/flowith/HADER_2030/manus/Ù‡Ù†Ø¯Ø³Ø© ÙˆÙ‡ÙŠÙƒÙ„Ø© Ù…Ø´Ø±ÙˆØ¹ Ø­Ø§Ø¶Ø± 2030.txt.zip",86107,"2025-11-17 20:42:27","zip"
"./web/flowith/HADER_2030/manus/Ù†Ø¸Ø§Ù… Ø§Ù•Ø¯Ø§Ø±Ø© Ø§Ù„Ù…Ø¹Ø±ÙØ© - Hader Knowledge Management System.md",10168,"2025-11-17 21:01:12","md"
"./web/flowith/HADER_2030/manus/manus_2030/haderos-complete-package-v3.zip",909891,"2025-11-20 19:42:01","zip"
"./web/flowith/HADER_2030/manus/manus_2030/haderos-complete-documentation.zip",46823,"2025-11-20 15:55:41","zip"
"./web/flowith/HADER_2030/manus/manus_2030/.DS_Store",14340,"2025-11-22 22:15:29","DS_Store"
"./web/flowith/HADER_2030/manus/manus_2030/haderos/.DS_Store",14340,"2025-11-22 22:12:24","DS_Store"
"./web/flowith/HADER_2030/manus/manus_2030/haderos/HaderOSv.1_Master_Dossier/07_Test_Data/sample_customers.csv",357,"2025-11-22 19:00:48","csv"
"./web/flowith/HADER_2030/manus/manus_2030/haderos/HaderOSv.1_Master_Dossier/07_Test_Data/sample_products.csv",504,"2025-11-22 19:00:48","csv"
"./web/flowith/HADER_2030/manus/manus_2030/haderos/HaderOSv.1_Master_Dossier/07_Test_Data/sample_orders.csv",894,"2025-11-22 19:00:48","csv"
"./web/flowith/HADER_2030/manus/manus_2030/haderos/HaderOSv.1_Master_Dossier/01_Executive_Summary/Glossary.md",14049,"2025-11-22 18:57:57","md"
"./web/flowith/HADER_2030/manus/manus_2030/haderos/HaderOSv.1_Master_Dossier/01_Executive_Summary/HaderOS_Overview.md",12995,"2025-11-22 18:55:09","md"
"./web/flowith/HADER_2030/manus/manus_2030/haderos/HaderOSv.1_Master_Dossier/01_Executive_Summary/Ecosystem_Map.md",13535,"2025-11-22 18:56:27","md"
"./web/flowith/HADER_2030/manus/manus_2030/haderos/HaderOSv.1_Master_Dossier/.DS_Store",24580,"2025-11-22 21:43:24","DS_Store"
"./web/flowith/HADER_2030/manus/manus_2030/haderos/HaderOSv.1_Master_Dossier/04_API_Documentation/haderos_integration_specs_v2.1.json",7408,"2025-11-22 18:58:13","json"
"./web/flowith/HADER_2030/manus/manus_2030/haderos/HaderOSv.1_Master_Dossier/04_API_Documentation/Repositories_Guide.md",145,"2025-11-22 19:00:31","md"
"./web/flowith/HADER_2030/manus/manus_2030/haderos/HaderOSv.1_Master_Dossier/04_API_Documentation/API_Specs.md",180,"2025-11-22 19:00:31","md"
"./web/flowith/HADER_2030/manus/manus_2030/haderos/HaderOSv.1_Master_Dossier/ğŸ“¦ HaderOS Master Technical Dossier.md",7533,"2025-11-22 19:01:44","md"
"./web/flowith/HADER_2030/manus/manus_2030/haderos/HaderOSv.1_Master_Dossier/03_Data_Governance/ERD.md",162,"2025-11-22 19:00:31","md"
"./web/flowith/HADER_2030/manus/manus_2030/haderos/HaderOSv.1_Master_Dossier/03_Data_Governance/Product_Modeling.md",144,"2025-11-22 19:00:31","md"
"./web/flowith/HADER_2030/manus/manus_2030/haderos/HaderOSv.1_Master_Dossier/03_Data_Governance/Source_of_Truth_Matrix.md",193,"2025-11-22 19:00:31","md"
"./web/flowith/HADER_2030/manus/manus_2030/haderos/HaderOSv.1_Master_Dossier/06_Roadmap/Technical_Backlog.md",173,"2025-11-22 19:00:31","md"
"./web/flowith/HADER_2030/manus/manus_2030/haderos/HaderOSv.1_Master_Dossier/06_Roadmap/Current_Sprint.md",140,"2025-11-22 19:00:31","md"
"./web/flowith/HADER_2030/manus/manus_2030/haderos/HaderOSv.1_Master_Dossier/06_Roadmap/HaderOS_Masters_Thesis_Bio_Adaptive_AI.md",70993,"2025-11-22 21:40:01","md"
"./web/flowith/HADER_2030/manus/manus_2030/haderos/HaderOSv.1_Master_Dossier/README.md",7533,"2025-11-22 18:53:50","md"
"./web/flowith/HADER_2030/manus/manus_2030/haderos/HaderOSv.1_Master_Dossier/05_DevOps/CI_CD_Pipelines.md",124,"2025-11-22 19:00:31","md"
"./web/flowith/HADER_2030/manus/manus_2030/haderos/HaderOSv.1_Master_Dossier/05_DevOps/Environment_Variables.md",162,"2025-11-22 19:00:31","md"
"./web/flowith/HADER_2030/manus/manus_2030/haderos/HaderOSv.1_Master_Dossier/05_DevOps/Local_Setup_Guide.md",199,"2025-11-22 19:00:31","md"
"./web/flowith/HADER_2030/manus/manus_2030/haderos/HaderOSv.1_Master_Dossier/02_Architecture/Infrastructure_Diagram.md",104,"2025-11-22 19:00:31","md"
"./web/flowith/HADER_2030/manus/manus_2030/haderos/HaderOSv.1_Master_Dossier/02_Architecture/Integration_Patterns.md",201,"2025-11-22 19:00:31","md"
"./web/flowith/HADER_2030/manus/manus_2030/haderos/HaderOSv.1_Master_Dossier/02_Architecture/Tech_Stack.md",8771,"2025-11-22 18:59:01","md"
"./web/flowith/HADER_2030/manus/manus_2030/haderos/HaderOSv.1_Master_Dossier.zip",48939,"2025-11-22 19:08:01","zip"
"./web/flowith/HADER_2030/manus/manus_2030/haderos/haderos-technical-implementation-guide.pdf",573897,"2025-11-22 16:54:55","pdf"
"./web/flowith/HADER_2030/manus/manus_2030/haderos/faso-haderos-2050-evaluation.md",30833,"2025-11-20 21:35:51","md"
"./web/flowith/HADER_2030/manus/manus_2030/haderos/Ù‡Ø¬ÙŠÙ†/HaderOS_Complete_Hybrid_Package.zip",886269,"2025-11-22 19:48:32","zip"
"./web/flowith/HADER_2030/manus/manus_2030/haderos/Ù‡Ø¬ÙŠÙ†/.DS_Store",10244,"2025-11-22 22:12:32","DS_Store"
"./web/flowith/HADER_2030/manus/manus_2030/haderos/Ù‡Ø¬ÙŠÙ†/ğŸ“¦ HaderOS Complete Hybrid Package.md",11287,"2025-11-22 19:48:45","md"
"./web/flowith/HADER_2030/manus/manus_2030/haderos/Ù‡Ø¬ÙŠÙ†/HaderOS_Complete_Hybrid_Package/.DS_Store",14340,"2025-11-22 22:10:33","DS_Store"
"./web/flowith/HADER_2030/manus/manus_2030/haderos/Ù‡Ø¬ÙŠÙ†/HaderOS_Complete_Hybrid_Package/04_API/haderos_integration_specs_v2.1.json",7408,"2025-11-22 19:46:28","json"
"./web/flowith/HADER_2030/manus/manus_2030/haderos/Ù‡Ø¬ÙŠÙ†/HaderOS_Complete_Hybrid_Package/04_API/Repositories_Guide.md",145,"2025-11-22 19:46:28","md"
"./web/flowith/HADER_2030/manus/manus_2030/haderos/Ù‡Ø¬ÙŠÙ†/HaderOS_Complete_Hybrid_Package/04_API/API_Specs.md",180,"2025-11-22 19:46:28","md"
"./web/flowith/HADER_2030/manus/manus_2030/haderos/Ù‡Ø¬ÙŠÙ†/HaderOS_Complete_Hybrid_Package/09_Advanced/haderos-metaprogramming-architecture.md",41606,"2025-11-22 19:46:36","md"
"./web/flowith/HADER_2030/manus/manus_2030/haderos/Ù‡Ø¬ÙŠÙ†/HaderOS_Complete_Hybrid_Package/09_Advanced/haderos-self-healing-poc.md",46779,"2025-11-22 19:46:36","md"
"./web/flowith/HADER_2030/manus/manus_2030/haderos/Ù‡Ø¬ÙŠÙ†/HaderOS_Complete_Hybrid_Package/06_Roadmap/HaderOS_Complete_Package/.DS_Store",10244,"2025-11-22 22:10:28","DS_Store"
"./web/flowith/HADER_2030/manus/manus_2030/haderos/Ù‡Ø¬ÙŠÙ†/HaderOS_Complete_Hybrid_Package/06_Roadmap/HaderOS_Complete_Package/thesis/HaderOS_Masters_Thesis_Complete.md",32220,"2025-11-22 22:05:31","md"
"./web/flowith/HADER_2030/manus/manus_2030/haderos/Ù‡Ø¬ÙŠÙ†/HaderOS_Complete_Hybrid_Package/06_Roadmap/HaderOS_Complete_Package/github_repo/.DS_Store",6148,"2025-11-22 22:09:49","DS_Store"
"./web/flowith/HADER_2030/manus/manus_2030/haderos/Ù‡Ø¬ÙŠÙ†/HaderOS_Complete_Hybrid_Package/06_Roadmap/HaderOS_Complete_Package/github_repo/requirements.txt",181,"2025-11-22 22:05:48","txt"
"./web/flowith/HADER_2030/manus/manus_2030/haderos/Ù‡Ø¬ÙŠÙ†/HaderOS_Complete_Hybrid_Package/06_Roadmap/HaderOS_Complete_Package/github_repo/haderos/__init__.py",401,"2025-11-22 22:06:49","py"
"./web/flowith/HADER_2030/manus/manus_2030/haderos/Ù‡Ø¬ÙŠÙ†/HaderOS_Complete_Hybrid_Package/06_Roadmap/HaderOS_Complete_Package/github_repo/haderos/protocols/ant_colony.py",5874,"2025-11-22 22:06:42","py"
"./web/flowith/HADER_2030/manus/manus_2030/haderos/Ù‡Ø¬ÙŠÙ†/HaderOS_Complete_Hybrid_Package/06_Roadmap/HaderOS_Complete_Package/github_repo/haderos/protocols/__init__.py",0,"2025-11-22 22:07:07","py"
"./web/flowith/HADER_2030/manus/manus_2030/haderos/Ù‡Ø¬ÙŠÙ†/HaderOS_Complete_Hybrid_Package/06_Roadmap/HaderOS_Complete_Package/github_repo/haderos/protocols/mycelium.py",5911,"2025-11-22 22:06:14","py"
"./web/flowith/HADER_2030/manus/manus_2030/haderos/Ù‡Ø¬ÙŠÙ†/HaderOS_Complete_Hybrid_Package/06_Roadmap/HaderOS_Complete_Package/github_repo/README.md",928,"2025-11-22 22:02:03","md"
"./web/flowith/HADER_2030/manus/manus_2030/haderos/Ù‡Ø¬ÙŠÙ†/HaderOS_Complete_Hybrid_Package/06_Roadmap/HaderOS_Complete_Package/github_repo/setup.py",401,"2025-11-22 22:05:48","py"
"./web/flowith/HADER_2030/manus/manus_2030/haderos/Ù‡Ø¬ÙŠÙ†/HaderOS_Complete_Hybrid_Package/06_Roadmap/HaderOS_Complete_Package/github_repo/examples/mycelium_demo.py",1086,"2025-11-22 22:07:07","py"
"./web/flowith/HADER_2030/manus/manus_2030/haderos/Ù‡Ø¬ÙŠÙ†/HaderOS_Complete_Hybrid_Package/06_Roadmap/HaderOS_Complete_Package/github_repo/examples/ant_colony_demo.py",2004,"2025-11-22 22:07:07","py"
"./web/flowith/HADER_2030/manus/manus_2030/haderos/Ù‡Ø¬ÙŠÙ†/HaderOS_Complete_Hybrid_Package/06_Roadmap/HaderOS_Complete_Package/github_repo/HaderOS_Masters_Thesis_Complete.md",32220,"2025-11-22 22:05:31","md"
"./web/flowith/HADER_2030/manus/manus_2030/haderos/Ù‡Ø¬ÙŠÙ†/HaderOS_Complete_Hybrid_Package/06_Roadmap/.DS_Store",10244,"2025-11-22 22:10:28","DS_Store"
"./web/flowith/HADER_2030/manus/manus_2030/haderos/Ù‡Ø¬ÙŠÙ†/HaderOS_Complete_Hybrid_Package/06_Roadmap/HaderOS_Complete_Package.zip",21141,"2025-11-22 22:08:01","zip"
"./web/flowith/HADER_2030/manus/manus_2030/haderos/Ù‡Ø¬ÙŠÙ†/HaderOS_Complete_Hybrid_Package/06_Roadmap/Technical_Backlog.md",173,"2025-11-22 19:46:28","md"
"./web/flowith/HADER_2030/manus/manus_2030/haderos/Ù‡Ø¬ÙŠÙ†/HaderOS_Complete_Hybrid_Package/06_Roadmap/HaderOS Bio-Adaptive AI.md",928,"2025-11-22 22:08:28","md"
"./web/flowith/HADER_2030/manus/manus_2030/haderos/Ù‡Ø¬ÙŠÙ†/HaderOS_Complete_Hybrid_Package/06_Roadmap/haderos-12month-roadmap.md",52751,"2025-11-22 21:40:23","md"
"./web/flowith/HADER_2030/manus/manus_2030/haderos/Ù‡Ø¬ÙŠÙ†/HaderOS_Complete_Hybrid_Package/06_Roadmap/Ø§Ù„ÙØµÙ„ Ø§Ù„Ø«Ø§Ù„Ø«: Ù¢.rtf",34438,"2025-11-22 21:51:11","rtf"
"./web/flowith/HADER_2030/manus/manus_2030/haderos/Ù‡Ø¬ÙŠÙ†/HaderOS_Complete_Hybrid_Package/06_Roadmap/Current_Sprint.md",140,"2025-11-22 19:46:28","md"
"./web/flowith/HADER_2030/manus/manus_2030/haderos/Ù‡Ø¬ÙŠÙ†/HaderOS_Complete_Hybrid_Package/06_Roadmap/Ø§Ù„ÙØµÙ„ Ø§Ù„Ø«Ø§Ù„Ø«:.rtf",38251,"2025-11-22 21:45:57","rtf"
"./web/flowith/HADER_2030/manus/manus_2030/haderos/Ù‡Ø¬ÙŠÙ†/HaderOS_Complete_Hybrid_Package/06_Roadmap/HaderOS_Masters_Thesis_Complete.md",32220,"2025-11-22 22:08:17","md"
"./web/flowith/HADER_2030/manus/manus_2030/haderos/Ù‡Ø¬ÙŠÙ†/HaderOS_Complete_Hybrid_Package/README.md",11287,"2025-11-22 19:47:36","md"
"./web/flowith/HADER_2030/manus/manus_2030/haderos/Ù‡Ø¬ÙŠÙ†/HaderOS_Complete_Hybrid_Package/05_DevOps/CI_CD_Pipelines.md",124,"2025-11-22 19:46:28","md"
"./web/flowith/HADER_2030/manus/manus_2030/haderos/Ù‡Ø¬ÙŠÙ†/HaderOS_Complete_Hybrid_Package/05_DevOps/Environment_Variables.md",162,"2025-11-22 19:46:28","md"
"./web/flowith/HADER_2030/manus/manus_2030/haderos/Ù‡Ø¬ÙŠÙ†/HaderOS_Complete_Hybrid_Package/05_DevOps/Local_Setup_Guide.md",199,"2025-11-22 19:46:28","md"
"./web/flowith/HADER_2030/manus/manus_2030/haderos/Ù‡Ø¬ÙŠÙ†/HaderOS_Complete_Hybrid_Package/01_Technical/Glossary.md",14049,"2025-11-22 19:46:28","md"
"./web/flowith/HADER_2030/manus/manus_2030/haderos/Ù‡Ø¬ÙŠÙ†/HaderOS_Complete_Hybrid_Package/01_Technical/HaderOS_Overview.md",12995,"2025-11-22 19:46:28","md"
"./web/flowith/HADER_2030/manus/manus_2030/haderos/Ù‡Ø¬ÙŠÙ†/HaderOS_Complete_Hybrid_Package/01_Technical/Ecosystem_Map.md",13535,"2025-11-22 19:46:28","md"
"./web/flowith/HADER_2030/manus/manus_2030/haderos/Ù‡Ø¬ÙŠÙ†/HaderOS_Complete_Hybrid_Package/07_TestData/sample_customers.csv",357,"2025-11-22 19:46:28","csv"
"./web/flowith/HADER_2030/manus/manus_2030/haderos/Ù‡Ø¬ÙŠÙ†/HaderOS_Complete_Hybrid_Package/07_TestData/sample_products.csv",504,"2025-11-22 19:46:28","csv"
"./web/flowith/HADER_2030/manus/manus_2030/haderos/Ù‡Ø¬ÙŠÙ†/HaderOS_Complete_Hybrid_Package/07_TestData/sample_orders.csv",894,"2025-11-22 19:46:28","csv"
"./web/flowith/HADER_2030/manus/manus_2030/haderos/Ù‡Ø¬ÙŠÙ†/HaderOS_Complete_Hybrid_Package/02_Architecture/haderos-gantt-chart.png",494534,"2025-11-22 19:46:36","png"
"./web/flowith/HADER_2030/manus/manus_2030/haderos/Ù‡Ø¬ÙŠÙ†/HaderOS_Complete_Hybrid_Package/02_Architecture/haderos-architecture-diagram.png",394809,"2025-11-22 19:46:36","png"
"./web/flowith/HADER_2030/manus/manus_2030/haderos/Ù‡Ø¬ÙŠÙ†/HaderOS_Complete_Hybrid_Package/02_Architecture/Infrastructure_Diagram.md",104,"2025-11-22 19:46:28","md"
"./web/flowith/HADER_2030/manus/manus_2030/haderos/Ù‡Ø¬ÙŠÙ†/HaderOS_Complete_Hybrid_Package/02_Architecture/Integration_Patterns.md",201,"2025-11-22 19:46:28","md"
"./web/flowith/HADER_2030/manus/manus_2030/haderos/Ù‡Ø¬ÙŠÙ†/HaderOS_Complete_Hybrid_Package/02_Architecture/Tech_Stack.md",8771,"2025-11-22 19:46:28","md"
"./web/flowith/HADER_2030/manus/manus_2030/haderos/Ù‡Ø¬ÙŠÙ†/HaderOS_Complete_Hybrid_Package/00_Executive/haderos-investor-report.md",24835,"2025-11-22 19:46:36","md"
"./web/flowith/HADER_2030/manus/manus_2030/haderos/Ù‡Ø¬ÙŠÙ†/HaderOS_Complete_Hybrid_Package/00_Executive/haderos-executive-summary-enhanced.md",17796,"2025-11-22 19:46:36","md"
"./web/flowith/HADER_2030/manus/manus_2030/haderos/Ù‡Ø¬ÙŠÙ†/HaderOS_Complete_Hybrid_Package/github_repo/.DS_Store",6148,"2025-11-22 22:10:33","DS_Store"
"./web/flowith/HADER_2030/manus/manus_2030/haderos/Ù‡Ø¬ÙŠÙ†/HaderOS_Complete_Hybrid_Package/github_repo/requirements.txt",181,"2025-11-22 22:05:48","txt"
"./web/flowith/HADER_2030/manus/manus_2030/haderos/Ù‡Ø¬ÙŠÙ†/HaderOS_Complete_Hybrid_Package/github_repo/haderos/__init__.py",401,"2025-11-22 22:06:49","py"
"./web/flowith/HADER_2030/manus/manus_2030/haderos/Ù‡Ø¬ÙŠÙ†/HaderOS_Complete_Hybrid_Package/github_repo/haderos/protocols/ant_colony.py",5874,"2025-11-22 22:06:42","py"
"./web/flowith/HADER_2030/manus/manus_2030/haderos/Ù‡Ø¬ÙŠÙ†/HaderOS_Complete_Hybrid_Package/github_repo/haderos/protocols/__init__.py",0,"2025-11-22 22:07:07","py"
"./web/flowith/HADER_2030/manus/manus_2030/haderos/Ù‡Ø¬ÙŠÙ†/HaderOS_Complete_Hybrid_Package/github_repo/haderos/protocols/mycelium.py",5911,"2025-11-22 22:06:14","py"
"./web/flowith/HADER_2030/manus/manus_2030/haderos/Ù‡Ø¬ÙŠÙ†/HaderOS_Complete_Hybrid_Package/github_repo/README.md",928,"2025-11-22 22:02:03","md"
"./web/flowith/HADER_2030/manus/manus_2030/haderos/Ù‡Ø¬ÙŠÙ†/HaderOS_Complete_Hybrid_Package/github_repo/setup.py",401,"2025-11-22 22:05:48","py"
"./web/flowith/HADER_2030/manus/manus_2030/haderos/Ù‡Ø¬ÙŠÙ†/HaderOS_Complete_Hybrid_Package/github_repo/examples/mycelium_demo.py",1086,"2025-11-22 22:07:07","py"
"./web/flowith/HADER_2030/manus/manus_2030/haderos/Ù‡Ø¬ÙŠÙ†/HaderOS_Complete_Hybrid_Package/github_repo/examples/ant_colony_demo.py",2004,"2025-11-22 22:07:07","py"
"./web/flowith/HADER_2030/manus/manus_2030/haderos/Ù‡Ø¬ÙŠÙ†/HaderOS_Complete_Hybrid_Package/github_repo/HaderOS_Masters_Thesis_Complete.md",32220,"2025-11-22 22:05:31","md"
"./web/flowith/HADER_2030/manus/manus_2030/haderos/Ù‡Ø¬ÙŠÙ†/HaderOS_Complete_Hybrid_Package/03_Data/ERD.md",162,"2025-11-22 19:46:28","md"
"./web/flowith/HADER_2030/manus/manus_2030/haderos/Ù‡Ø¬ÙŠÙ†/HaderOS_Complete_Hybrid_Package/03_Data/Product_Modeling.md",144,"2025-11-22 19:46:28","md"
"./web/flowith/HADER_2030/manus/manus_2030/haderos/Ù‡Ø¬ÙŠÙ†/HaderOS_Complete_Hybrid_Package/03_Data/Source_of_Truth_Matrix.md",193,"2025-11-22 19:46:28","md"
"./web/flowith/HADER_2030/manus/manus_2030/haderos/Ù‡Ø¬ÙŠÙ†/HaderOS_Complete_Hybrid_Package/08_Governance/haderos-governance-policies.md",28218,"2025-11-22 19:46:36","md"
"./web/flowith/HADER_2030/manus/manus_2030/haderos/Ù‡Ø¬ÙŠÙ†/ğŸ“Š ØªÙ‚Ø±ÙŠØ± Ø§Ù„Ù…Ù‚Ø§Ø±Ù†Ø©_ Ø§Ù„Ø­Ø²Ù…Ø© Ø§Ù„Ù‚Ø¯ÙŠÙ…Ø© vs Master Dossier Ø§Ù„Ø¬Ø¯ÙŠØ¯.md",11432,"2025-11-22 19:44:30","md"
"./web/flowith/HADER_2030/manus/manus_2030/haderos/Ù‡Ø¬ÙŠÙ†/ğŸ“¦_HaderOS_Complete_Hybrid_Package.pdf",491526,"2025-11-22 19:48:49","pdf"
"./web/flowith/HADER_2030/manus/manus_2030/haderos/HaderOS_Master_Dossier.zip",31289,"2025-11-22 19:01:50","zip"
"./web/flowith/HADER_2030/manus/manus_2030/Ù…Ù‚Ø¯Ù…Ø©.docx",23836,"2025-11-20 20:28:31","docx"
"./web/flowith/HADER_2030/manus/manus_2030/haderos-complete-documentation/haderos-12month-roadmap.md.docx",24087,"2025-11-20 15:56:07","docx"
"./web/flowith/HADER_2030/manus/manus_2030/haderos-complete-documentation/ğŸ“š ÙˆØ«Ø§ÙŠÙ”Ù‚ HaderOS Ø§Ù„Ø´Ø§Ù…Ù„Ø©.md",8605,"2025-11-20 15:55:56","md"
"./web/flowith/HADER_2030/manus/manus_2030/haderos-complete-documentation/haderos-metaprogramming-architecture.md",41606,"2025-11-20 02:21:21","md"
"./web/flowith/HADER_2030/manus/manus_2030/haderos-complete-documentation/haderos-investor-report.md",24835,"2025-11-20 02:26:10","md"
"./web/flowith/HADER_2030/manus/manus_2030/haderos-complete-documentation/haderos-self-healing-poc.md",46779,"2025-11-20 02:23:46","md"
"./web/flowith/HADER_2030/manus/manus_2030/haderos-complete-documentation/haderos-metaprogramming-architecture.md.docx",42102,"2025-11-20 15:56:22","docx"
"./web/flowith/HADER_2030/manus/manus_2030/haderos-complete-documentation/haderos-12month-roadmap.md",33987,"2025-11-20 02:18:51","md"
"./web/flowith/HADER_2030/manus/manus_2030/haderos-complete-documentation/haderos-self-healing-poc.md.docx",45297,"2025-11-20 15:56:33","docx"
"./web/flowith/HADER_2030/manus/manus_2030/haderos-complete-documentation/haderos-governance-policies.md",28218,"2025-11-20 02:28:47","md"
"./web/flowith/HADER_2030/manus/manus_2030/haderos-complete-package-v3/.DS_Store",10244,"2025-11-20 20:28:36","DS_Store"
"./web/flowith/HADER_2030/manus/manus_2030/haderos-complete-package-v3/Ø§Ù„Ù…Ù„Ø®Øµ Ø§Ù„ØªÙ†ÙÙŠØ°ÙŠ - HaderOS.md",17796,"2025-11-20 19:13:48","md"
"./web/flowith/HADER_2030/manus/manus_2030/haderos-complete-package-v3/haderos-gantt-chart.png",494534,"2025-11-20 19:10:33","png"
"./web/flowith/HADER_2030/manus/manus_2030/haderos-complete-package-v3/haderos-architecture-diagram.png",394809,"2025-11-20 19:11:19","png"
"./web/flowith/HADER_2030/manus/manus_2030/haderos-complete-package-v3/haderos-architecture-diagram.mmd",3973,"2025-11-20 19:11:08","mmd"
"./web/flowith/HADER_2030/manus/manus_2030/haderos-complete-package-v3/haderos-gantt-chart.mmd",1882,"2025-11-20 19:10:22","mmd"
"./web/flowith/HADER_2030/manus/manus_2030/haderos-complete-package-v3/haderos-metaprogramming-architecture.md",41606,"2025-11-20 02:21:21","md"
"./web/flowith/HADER_2030/manus/manus_2030/haderos-complete-package-v3/ğŸ“¦ HaderOS - Ø§Ù„Ø­Ø²Ù…Ø© Ø§Ù„ÙƒØ§Ù…Ù„Ø© Ø§Ù„Ù…ØªÙƒØ§Ù…Ù„Ø©.md",10459,"2025-11-20 19:13:48","md"
"./web/flowith/HADER_2030/manus/manus_2030/haderos-complete-package-v3/haderos-investor-report.md",24835,"2025-11-20 02:26:10","md"
"./web/flowith/HADER_2030/manus/manus_2030/haderos-complete-package-v3/haderos-self-healing-poc.md",46779,"2025-11-20 02:23:46","md"
"./web/flowith/HADER_2030/manus/manus_2030/haderos-complete-package-v3/haderos-executive-summary-enhanced.md",17796,"2025-11-20 19:09:25","md"
"./web/flowith/HADER_2030/manus/manus_2030/haderos-complete-package-v3/HADEROS_COMPLETE_PACKAGE_README.md",10459,"2025-11-20 19:12:42","md"
"./web/flowith/HADER_2030/manus/manus_2030/haderos-complete-package-v3/haderos-12month-roadmap.md",33987,"2025-11-20 02:18:51","md"
"./web/flowith/HADER_2030/manus/manus_2030/haderos-complete-package-v3/haderos-governance-policies.md",28218,"2025-11-20 02:28:47","md"
"./web/flowith/HADER_2030/manus/manus_2030/haderos-complete-package-v3/upload/pasted_file_65lG9B_Ø§Ù„Ù…Ù„Ø®ØµØ§Ù„ØªÙ†ÙÙŠØ°ÙŠ.pdf",51796,"2025-11-20 19:02:31","pdf"
"./web/flowith/HADER_2030/manus/manus_2030/haderos-comprehensive-evaluation.md.docx",31320,"2025-11-20 21:24:27","docx"
"./web/flowith/HADER_2030/manus/ğŸ“¦ Ø¨ÙŠØ§Ù† Ø§Ù„ØªØ³Ù„ÙŠÙ… - Delivery Manifest.md",15052,"2025-11-17 21:01:21","md"
"./web/flowith/HADER_2030/manus/Ù‡Ù†Ø¯Ø³Ø© ÙˆÙ‡ÙŠÙƒÙ„Ø© Ù…Ø´Ø±ÙˆØ¹ Ø­Ø§Ø¶Ø± 2030.txt",345711,"2025-11-17 20:41:05","txt"
"./web/flowith/HADER_2030/manus/hader-knowledge/build_index.py",13722,"2025-11-17 20:55:04","py"
"./web/flowith/HADER_2030/manus/hader-knowledge/build_index_md.py",6512,"2025-11-17 20:07:57","py"
"./web/flowith/HADER_2030/manus/hader-knowledge/knowledge_graph/knowledge_graph.json",11905,"2025-11-17 20:55:32","json"
"./web/flowith/HADER_2030/manus/hader-knowledge/knowledge_graph/knowledge_graph.md",10546,"2025-11-17 20:55:32","md"
"./web/flowith/HADER_2030/manus/hader-knowledge/knowledge_graph/knowledge_graph.mmd",3171,"2025-11-17 20:55:32","mmd"
"./web/flowith/HADER_2030/manus/hader-knowledge/.DS_Store",10244,"2025-11-22 22:15:29","DS_Store"
"./web/flowith/HADER_2030/manus/hader-knowledge/cli/CLI_SPECIFICATIONS.md",11185,"2025-11-17 20:12:11","md"
"./web/flowith/HADER_2030/manus/hader-knowledge/README.md",10168,"2025-11-17 20:58:34","md"
"./web/flowith/HADER_2030/manus/hader-knowledge/hader-knowledge 3/build_index.py",13290,"2025-11-17 20:06:30","py"
"./web/flowith/HADER_2030/manus/hader-knowledge/hader-knowledge 3/build_index_md.py",6512,"2025-11-17 20:07:57","py"
"./web/flowith/HADER_2030/manus/hader-knowledge/hader-knowledge 3/knowledge_graph/knowledge_graph.json",11558,"2025-11-17 20:09:23","json"
"./web/flowith/HADER_2030/manus/hader-knowledge/hader-knowledge 3/knowledge_graph/knowledge_graph.md",10309,"2025-11-17 20:09:23","md"
"./web/flowith/HADER_2030/manus/hader-knowledge/hader-knowledge 3/knowledge_graph/knowledge_graph.mmd",3042,"2025-11-17 20:09:23","mmd"
"./web/flowith/HADER_2030/manus/hader-knowledge/hader-knowledge 3/cli/CLI_SPECIFICATIONS.md",11185,"2025-11-17 20:12:11","md"
"./web/flowith/HADER_2030/manus/hader-knowledge/hader-knowledge 3/README.md",9938,"2025-11-17 20:14:14","md"
"./web/flowith/HADER_2030/manus/hader-knowledge/hader-knowledge 3/build_knowledge_graph.py",14283,"2025-11-17 20:09:18","py"
"./web/flowith/HADER_2030/manus/hader-knowledge/hader-knowledge 3/glossary/glossary.md",10754,"2025-11-17 20:11:01","md"
"./web/flowith/HADER_2030/manus/hader-knowledge/hader-knowledge 3/glossary/glossary.json",12967,"2025-11-17 20:11:01","json"
"./web/flowith/HADER_2030/manus/hader-knowledge/hader-knowledge 3/build_glossary.py",19080,"2025-11-17 20:10:56","py"
"./web/flowith/HADER_2030/manus/hader-knowledge/hader-knowledge 3/DELIVERY_MANIFEST.md",10532,"2025-11-17 20:13:18","md"
"./web/flowith/HADER_2030/manus/hader-knowledge/hader-knowledge 3/frameworks/temp_file_list.txt",6908,"2025-11-17 19:22:46","txt"
"./web/flowith/HADER_2030/manus/hader-knowledge/hader-knowledge 3/frameworks/00_HADEROS_FILE_MAP.md",8997,"2025-11-17 20:03:41","md"
"./web/flowith/HADER_2030/manus/hader-knowledge/hader-knowledge 3/frameworks/00_FILES_OVERVIEW.md",8775,"2025-11-17 19:23:53","md"
"./web/flowith/HADER_2030/manus/hader-knowledge/hader-knowledge 3/data/02_operations/11_whatsapp_all_messages_meta.txt",1037,"2025-11-17 19:25:12","txt"
"./web/flowith/HADER_2030/manus/hader-knowledge/hader-knowledge 3/data/02_operations/08_pop_footwear_costing.txt",776,"2025-11-17 19:25:12","txt"
"./web/flowith/HADER_2030/manus/hader-knowledge/hader-knowledge 3/data/02_operations/whatsapp_last3days.txt",90,"2025-11-17 19:25:12","txt"
"./web/flowith/HADER_2030/manus/hader-knowledge/hader-knowledge 3/data/02_operations/04_yawmiat_tahseelaat.txt",9083,"2025-11-17 19:25:12","txt"
"./web/flowith/HADER_2030/manus/hader-knowledge/hader-knowledge 3/data/02_operations/14_taqreer_alhaykal_waltaaheel_2025.txt",1097,"2025-11-17 19:25:12","txt"
"./web/flowith/HADER_2030/manus/hader-knowledge/hader-knowledge 3/data/02_operations/13_wa_reports_index.txt",982,"2025-11-17 19:25:12","txt"
"./web/flowith/HADER_2030/manus/hader-knowledge/hader-knowledge 3/data/02_operations/05_reports_and_kpis.txt",4005,"2025-11-17 19:25:12","txt"
"./web/flowith/HADER_2030/manus/hader-knowledge/hader-knowledge 3/data/02_operations/SUMMARY.txt",43,"2025-11-17 19:25:12","txt"
"./web/flowith/HADER_2030/manus/hader-knowledge/hader-knowledge 3/data/02_operations/10_wa_last3days_sent_meta.txt",1075,"2025-11-17 19:25:12","txt"
"./web/flowith/HADER_2030/manus/hader-knowledge/hader-knowledge 3/data/02_operations/09_wa_last3days_all_meta.txt",1096,"2025-11-17 19:25:12","txt"
"./web/flowith/HADER_2030/manus/hader-knowledge/hader-knowledge 3/data/02_operations/06_now_shoes_verification_pack.txt",1142,"2025-11-17 19:25:12","txt"
"./web/flowith/HADER_2030/manus/hader-knowledge/hader-knowledge 3/data/02_operations/01_daily_operations_tracker.txt",21217,"2025-11-17 19:25:12","txt"
"./web/flowith/HADER_2030/manus/hader-knowledge/hader-knowledge 3/data/02_operations/07_bazooka_orders_2025_04_198.txt",13784,"2025-11-17 19:25:12","txt"
"./web/flowith/HADER_2030/manus/hader-knowledge/hader-knowledge 3/data/02_operations/whatsapp_ALL_messages.txt",23521057,"2025-11-17 19:25:12","txt"
"./web/flowith/HADER_2030/manus/hader-knowledge/hader-knowledge 3/data/02_operations/wa_last3days_sent.txt",103694,"2025-11-17 19:25:12","txt"
"./web/flowith/HADER_2030/manus/hader-knowledge/hader-knowledge 3/data/02_operations/09_whatsapp_data_sources.txt",1561,"2025-11-17 19:25:12","txt"
"./web/flowith/HADER_2030/manus/hader-knowledge/hader-knowledge 3/data/02_operations/02_yawmiat_tasleemat.txt",7031,"2025-11-17 19:25:12","txt"
"./web/flowith/HADER_2030/manus/hader-knowledge/hader-knowledge 3/data/02_operations/06_operational_costs_log.txt",14809,"2025-11-17 19:25:12","txt"
"./web/flowith/HADER_2030/manus/hader-knowledge/hader-knowledge 3/data/02_operations/12_whatsapp_last3days_meta.txt",998,"2025-11-17 19:25:12","txt"
"./web/flowith/HADER_2030/manus/hader-knowledge/hader-knowledge 3/data/02_operations/03_yawmiat_mortaga3at.txt",6715,"2025-11-17 19:25:12","txt"
"./web/flowith/HADER_2030/manus/hader-knowledge/hader-knowledge 3/data/02_operations/wa_last3days_all.txt",290545,"2025-11-17 19:25:12","txt"
"./web/flowith/HADER_2030/manus/hader-knowledge/hader-knowledge 3/data/05_twins/05-04_process_system_digital_twin.txt",8654,"2025-11-17 20:01:27","txt"
"./web/flowith/HADER_2030/manus/hader-knowledge/hader-knowledge 3/data/05_twins/02_human_digital_twin_engine.txt",9120,"2025-11-17 20:01:27","txt"
"./web/flowith/HADER_2030/manus/hader-knowledge/hader-knowledge 3/data/05_twins/04_kaia_al_himma_agent.txt",1142,"2025-11-17 20:01:27","txt"
"./web/flowith/HADER_2030/manus/hader-knowledge/hader-knowledge 3/data/05_twins/02_kaia_al_asas_agent.txt",1123,"2025-11-17 20:01:27","txt"
"./web/flowith/HADER_2030/manus/hader-knowledge/hader-knowledge 3/data/05_twins/03_kaia_al_itqan_agent.txt",1141,"2025-11-17 20:01:27","txt"
"./web/flowith/HADER_2030/manus/hader-knowledge/hader-knowledge 3/data/05_twins/03_kaia_factory_and_logistics_agents.txt",1328,"2025-11-17 20:01:27","txt"
"./web/flowith/HADER_2030/manus/hader-knowledge/hader-knowledge 3/data/05_twins/05-05_digital_twins_integration_architecture.txt",4655,"2025-11-17 20:01:27","txt"
"./web/flowith/HADER_2030/manus/hader-knowledge/hader-knowledge 3/data/05_twins/05-06_digital_twins_console_and_operations.txt",9505,"2025-11-17 20:01:27","txt"
"./web/flowith/HADER_2030/manus/hader-knowledge/hader-knowledge 3/data/05_twins/05_makc_overview.txt",1177,"2025-11-17 20:01:27","txt"
"./web/flowith/HADER_2030/manus/hader-knowledge/hader-knowledge 3/data/05_twins/02_makc_overview.txt",1365,"2025-11-17 20:01:27","txt"
"./web/flowith/HADER_2030/manus/hader-knowledge/hader-knowledge 3/data/05_twins/01_kaia_overview.txt",1417,"2025-11-17 20:01:27","txt"
"./web/flowith/HADER_2030/manus/hader-knowledge/hader-knowledge 3/data/05_twins/05-03_machine_digital_twin_engine.txt",10576,"2025-11-17 20:01:27","txt"
"./web/flowith/HADER_2030/manus/hader-knowledge/hader-knowledge 3/data/01_constitution/hader_constitution.txt",22672,"2025-11-17 19:25:12","txt"
"./web/flowith/HADER_2030/manus/hader-knowledge/hader-knowledge 3/data/01_constitution/03_laiha_tashgheeliya_hader_2030.txt",16346,"2025-11-17 19:25:12","txt"
"./web/flowith/HADER_2030/manus/hader-knowledge/hader-knowledge 3/data/01_constitution/02_dostour_taseesi_sharikat_hader_2030.txt",14616,"2025-11-17 19:25:12","txt"
"./web/flowith/HADER_2030/manus/hader-knowledge/hader-knowledge 3/data/01_constitution/01_mithaq_taseesi_mashrou3_hader_2030.txt",11951,"2025-11-17 19:25:12","txt"
"./web/flowith/HADER_2030/manus/hader-knowledge/hader-knowledge 3/data/01_constitution/01_mithaq_tasis_hader_2030.txt",1290,"2025-11-17 19:25:12","txt"
"./web/flowith/HADER_2030/manus/hader-knowledge/hader-knowledge 3/data/08_marketing/01_campaign_elle_3amlooh_b2edena_template.txt",1257,"2025-11-17 19:25:35","txt"
"./web/flowith/HADER_2030/manus/hader-knowledge/hader-knowledge 3/data/08_marketing/06_makc_report_md_meta.txt",1112,"2025-11-17 19:25:35","txt"
"./web/flowith/HADER_2030/manus/hader-knowledge/hader-knowledge 3/data/08_marketing/02_campaign_elle_3amlooh_b2edena_production_book.txt",1164,"2025-11-17 19:25:35","txt"
"./web/flowith/HADER_2030/manus/hader-knowledge/hader-knowledge 3/data/08_marketing/04_makc_ads_csv_meta.txt",1116,"2025-11-17 19:25:35","txt"
"./web/flowith/HADER_2030/manus/hader-knowledge/hader-knowledge 3/data/08_marketing/05_makc_plan_md_meta.txt",1062,"2025-11-17 19:25:35","txt"
"./web/flowith/HADER_2030/manus/hader-knowledge/hader-knowledge 3/data/08_marketing/03_hader_project_card_overview.txt",1141,"2025-11-17 19:25:35","txt"
"./web/flowith/HADER_2030/manus/hader-knowledge/hader-knowledge 3/data/03_knowledge/03-05_hka_kaia_haderos_integration.txt",5978,"2025-11-17 19:25:12","txt"
"./web/flowith/HADER_2030/manus/hader-knowledge/hader-knowledge 3/data/03_knowledge/01_hader_bilingual_master_v1_7_1.txt",1170,"2025-11-17 19:25:12","txt"
"./web/flowith/HADER_2030/manus/hader-knowledge/hader-knowledge 3/data/03_knowledge/03-02_hka_knowledge_graph_spec.txt",6481,"2025-11-17 19:25:12","txt"
"./web/flowith/HADER_2030/manus/hader-knowledge/hader-knowledge 3/data/03_knowledge/03_ecart_required_data.txt",1116,"2025-11-17 19:25:12","txt"
"./web/flowith/HADER_2030/manus/hader-knowledge/hader-knowledge 3/data/03_knowledge/03-06_hka_reasoning_templates.txt",6637,"2025-11-17 19:25:12","txt"
"./web/flowith/HADER_2030/manus/hader-knowledge/hader-knowledge 3/data/03_knowledge/03-01_hka_blueprint.txt",2790,"2025-11-17 19:25:12","txt"
"./web/flowith/HADER_2030/manus/hader-knowledge/hader-knowledge 3/data/03_knowledge/03-03_hka_reasoning_engine_spec.txt",5909,"2025-11-17 19:25:12","txt"
"./web/flowith/HADER_2030/manus/hader-knowledge/hader-knowledge 3/data/03_knowledge/03-10_hka_causal_engine.txt",5332,"2025-11-17 19:25:12","txt"
"./web/flowith/HADER_2030/manus/hader-knowledge/hader-knowledge 3/data/03_knowledge/03-09_hka_knowledge_graph_schema.txt",4751,"2025-11-17 19:25:12","txt"
"./web/flowith/HADER_2030/manus/hader-knowledge/hader-knowledge 3/data/03_knowledge/03-04_hader_product_structure_brief_v1_7_3.txt",6244,"2025-11-17 19:25:12","txt"
"./web/flowith/HADER_2030/manus/hader-knowledge/hader-knowledge 3/data/03_knowledge/03-07_hka_knowledge_graph.txt",4806,"2025-11-17 19:25:12","txt"
"./web/flowith/HADER_2030/manus/hader-knowledge/hader-knowledge 3/data/03_knowledge/04_hader_product_structure_brief_v1_7_3.txt",1032,"2025-11-17 19:25:12","txt"
"./web/flowith/HADER_2030/manus/hader-knowledge/hader-knowledge 3/data/03_knowledge/03-08_hka_decision_maps_library.txt",6585,"2025-11-17 19:25:12","txt"
"./web/flowith/HADER_2030/manus/hader-knowledge/hader-knowledge 3/data/03_knowledge/02_hader_product_import_template_v1.txt",1145,"2025-11-17 19:25:12","txt"
"./web/flowith/HADER_2030/manus/hader-knowledge/hader-knowledge 3/data/10_culture/12_hader_system_integrated_analysis_2025-11.txt",2726,"2025-11-17 19:25:35","txt"
"./web/flowith/HADER_2030/manus/hader-knowledge/hader-knowledge 3/data/07_products/06_pop_catalogue_all_models.txt",1200,"2025-11-17 19:25:35","txt"
"./web/flowith/HADER_2030/manus/hader-knowledge/hader-knowledge 3/data/07_products/03_product_M01_filter_wadi_al_naqaa.txt",1234,"2025-11-17 19:25:35","txt"
"./web/flowith/HADER_2030/manus/hader-knowledge/hader-knowledge 3/data/07_products/01_kemit_overview.txt",1253,"2025-11-17 19:25:35","txt"
"./web/flowith/HADER_2030/manus/hader-knowledge/hader-knowledge 3/data/07_products/04_product_M03_pottery_solar_cooler.txt",1285,"2025-11-17 19:25:35","txt"
"./web/flowith/HADER_2030/manus/hader-knowledge/hader-knowledge 3/data/07_products/05_product_B01_toba_khbari.txt",1257,"2025-11-17 19:25:35","txt"
"./web/flowith/HADER_2030/manus/hader-knowledge/hader-knowledge 3/data/07_products/02_method_70_30.txt",1208,"2025-11-17 19:25:35","txt"
"./web/flowith/HADER_2030/manus/hader-knowledge/hader-knowledge 3/data/06_kaia/02_levels_L1_to_L5.txt",1081,"2025-11-17 19:25:35","txt"
"./web/flowith/HADER_2030/manus/hader-knowledge/hader-knowledge 3/data/06_kaia/02_leadership_path_tasks_bank.txt",1229,"2025-11-17 19:25:35","txt"
"./web/flowith/HADER_2030/manus/hader-knowledge/hader-knowledge 3/data/06_kaia/04_hre_and_kaia_in_leadership_evaluation.txt",1331,"2025-11-17 19:25:35","txt"
"./web/flowith/HADER_2030/manus/hader-knowledge/hader-knowledge 3/data/06_kaia/04_kaia_al_himma_agent.txt",1142,"2025-11-17 19:25:12","txt"
"./web/flowith/HADER_2030/manus/hader-knowledge/hader-knowledge 3/data/06_kaia/01_hader_academy_overview_L1_L5.txt",1367,"2025-11-17 19:25:35","txt"
"./web/flowith/HADER_2030/manus/hader-knowledge/hader-knowledge 3/data/06_kaia/02_kaia_al_asas_agent.txt",1123,"2025-11-17 19:25:12","txt"
"./web/flowith/HADER_2030/manus/hader-knowledge/hader-knowledge 3/data/06_kaia/03_kaia_al_itqan_agent.txt",1141,"2025-11-17 19:25:12","txt"
"./web/flowith/HADER_2030/manus/hader-knowledge/hader-knowledge 3/data/06_kaia/03_kaia_factory_and_logistics_agents.txt",1328,"2025-11-17 19:25:12","txt"
"./web/flowith/HADER_2030/manus/hader-knowledge/hader-knowledge 3/data/06_kaia/04_task_bank_and_kpis.txt",1133,"2025-11-17 19:25:35","txt"
"./web/flowith/HADER_2030/manus/hader-knowledge/hader-knowledge 3/data/06_kaia/03_cell_of_9_equity.txt",1220,"2025-11-17 19:25:35","txt"
"./web/flowith/HADER_2030/manus/hader-knowledge/hader-knowledge 3/data/06_kaia/06-02_kaia_context_engine.txt",10654,"2025-11-17 20:02:35","txt"
"./web/flowith/HADER_2030/manus/hader-knowledge/hader-knowledge 3/data/06_kaia/01_hader_academy_overview.txt",1080,"2025-11-17 19:25:35","txt"
"./web/flowith/HADER_2030/manus/hader-knowledge/hader-knowledge 3/data/06_kaia/05_makc_overview.txt",1177,"2025-11-17 19:25:12","txt"
"./web/flowith/HADER_2030/manus/hader-knowledge/hader-knowledge 3/data/06_kaia/02_makc_overview.txt",1365,"2025-11-17 19:25:12","txt"
"./web/flowith/HADER_2030/manus/hader-knowledge/hader-knowledge 3/data/06_kaia/01_kaia_overview.txt",1417,"2025-11-17 19:25:12","txt"
"./web/flowith/HADER_2030/manus/hader-knowledge/hader-knowledge 3/data/06_kaia/03_cell_of_9_equity_promotion.txt",1266,"2025-11-17 19:25:35","txt"
"./web/flowith/HADER_2030/manus/hader-knowledge/hader-knowledge 3/data/09_investment/02_investment_funds_learning_series.txt",1312,"2025-11-17 19:25:35","txt"
"./web/flowith/HADER_2030/manus/hader-knowledge/hader-knowledge 3/data/09_investment/03_hader_financing_philosophy_equity_based.txt",1185,"2025-11-17 19:25:35","txt"
"./web/flowith/HADER_2030/manus/hader-knowledge/hader-knowledge 3/data/09_investment/01_hader_ebs_financial_220425.txt",1202,"2025-11-17 19:25:35","txt"
"./web/flowith/HADER_2030/manus/hader-knowledge/hader-knowledge 3/data/04_haderos/05_security_zero_trust.txt",1251,"2025-11-17 19:25:12","txt"
"./web/flowith/HADER_2030/manus/hader-knowledge/hader-knowledge 3/data/04_haderos/07_hader_contingency_plan_2025_11_15.txt",3585,"2025-11-17 19:25:12","txt"
"./web/flowith/HADER_2030/manus/hader-knowledge/hader-knowledge 3/data/04_haderos/06_hader_master_implementation_plan_2025_11_15.txt",2237,"2025-11-17 19:25:12","txt"
"./web/flowith/HADER_2030/manus/hader-knowledge/hader-knowledge 3/data/04_haderos/03_haderos_data_engine.txt",4375,"2025-11-17 19:25:12","txt"
"./web/flowith/HADER_2030/manus/hader-knowledge/hader-knowledge 3/data/04_haderos/03_human_role_engine.txt",1211,"2025-11-17 19:25:12","txt"
"./web/flowith/HADER_2030/manus/hader-knowledge/hader-knowledge 3/data/04_haderos/04_haderos_knowledge_graph_engine.txt",3862,"2025-11-17 19:25:12","txt"
"./web/flowith/HADER_2030/manus/hader-knowledge/hader-knowledge 3/data/04_haderos/01_haderos_overview.txt",6233,"2025-11-17 19:25:12","txt"
"./web/flowith/HADER_2030/manus/hader-knowledge/hader-knowledge 3/data/04_haderos/05_haderos_event_engine.txt",3814,"2025-11-17 19:25:12","txt"
"./web/flowith/HADER_2030/manus/hader-knowledge/hader-knowledge 3/data/04_haderos/04_digital_twin_layer.txt",8853,"2025-11-17 19:25:12","txt"
"./web/flowith/HADER_2030/manus/hader-knowledge/hader-knowledge 3/data/04_haderos/02_haderos_core_engine.txt",7112,"2025-11-17 19:25:12","txt"
"./web/flowith/HADER_2030/manus/hader-knowledge/hader-knowledge 3/data/04_haderos/02_haderos_architecture_core.txt",15272,"2025-11-17 19:25:12","txt"
"./web/flowith/HADER_2030/manus/hader-knowledge/hader-knowledge 3/data/04_haderos/04_event_engine.txt",5901,"2025-11-17 19:25:12","txt"
"./web/flowith/HADER_2030/manus/hader-knowledge/hader-knowledge 3/indexes/index_schema.md",10485,"2025-11-17 20:04:49","md"
"./web/flowith/HADER_2030/manus/hader-knowledge/hader-knowledge 3/indexes/index.md",81212,"2025-11-17 20:08:04","md"
"./web/flowith/HADER_2030/manus/hader-knowledge/hader-knowledge 3/indexes/index.json",108328,"2025-11-17 20:06:37","json"
"./web/flowith/HADER_2030/manus/hader-knowledge/build_knowledge_graph.py",14283,"2025-11-17 20:09:18","py"
"./web/flowith/HADER_2030/manus/hader-knowledge/glossary/glossary.md",13049,"2025-11-17 20:57:13","md"
"./web/flowith/HADER_2030/manus/hader-knowledge/glossary/glossary.json",16875,"2025-11-17 20:56:57","json"
"./web/flowith/HADER_2030/manus/hader-knowledge/add_new_terms.py",5280,"2025-11-17 20:56:28","py"
"./web/flowith/HADER_2030/manus/hader-knowledge/hader-knowledge 2/build_index.py",13722,"2025-11-17 20:55:04","py"
"./web/flowith/HADER_2030/manus/hader-knowledge/hader-knowledge 2/build_index_md.py",6512,"2025-11-17 20:07:57","py"
"./web/flowith/HADER_2030/manus/hader-knowledge/hader-knowledge 2/knowledge_graph/knowledge_graph.json",11905,"2025-11-17 20:55:32","json"
"./web/flowith/HADER_2030/manus/hader-knowledge/hader-knowledge 2/knowledge_graph/knowledge_graph.md",10546,"2025-11-17 20:55:32","md"
"./web/flowith/HADER_2030/manus/hader-knowledge/hader-knowledge 2/knowledge_graph/knowledge_graph.mmd",3171,"2025-11-17 20:55:32","mmd"
"./web/flowith/HADER_2030/manus/hader-knowledge/hader-knowledge 2/cli/CLI_SPECIFICATIONS.md",11185,"2025-11-17 20:12:11","md"
"./web/flowith/HADER_2030/manus/hader-knowledge/hader-knowledge 2/README.md",10168,"2025-11-17 20:58:34","md"
"./web/flowith/HADER_2030/manus/hader-knowledge/hader-knowledge 2/build_knowledge_graph.py",14283,"2025-11-17 20:09:18","py"
"./web/flowith/HADER_2030/manus/hader-knowledge/hader-knowledge 2/glossary/glossary.md",13049,"2025-11-17 20:57:13","md"
"./web/flowith/HADER_2030/manus/hader-knowledge/hader-knowledge 2/glossary/glossary.json",16875,"2025-11-17 20:56:57","json"
"./web/flowith/HADER_2030/manus/hader-knowledge/hader-knowledge 2/add_new_terms.py",5280,"2025-11-17 20:56:28","py"
"./web/flowith/HADER_2030/manus/hader-knowledge/hader-knowledge 2/build_glossary.py",19080,"2025-11-17 20:10:56","py"
"./web/flowith/HADER_2030/manus/hader-knowledge/hader-knowledge 2/DELIVERY_MANIFEST.md",10532,"2025-11-17 20:13:18","md"
"./web/flowith/HADER_2030/manus/hader-knowledge/hader-knowledge 2/frameworks/temp_file_list.txt",6908,"2025-11-17 19:22:46","txt"
"./web/flowith/HADER_2030/manus/hader-knowledge/hader-knowledge 2/frameworks/00_HADEROS_FILE_MAP.md",8997,"2025-11-17 20:03:41","md"
"./web/flowith/HADER_2030/manus/hader-knowledge/hader-knowledge 2/frameworks/00_FILES_OVERVIEW.md",8775,"2025-11-17 19:23:53","md"
"./web/flowith/HADER_2030/manus/hader-knowledge/hader-knowledge 2/data/02_operations/11_whatsapp_all_messages_meta.txt",1037,"2025-11-17 19:25:12","txt"
"./web/flowith/HADER_2030/manus/hader-knowledge/hader-knowledge 2/data/02_operations/08_pop_footwear_costing.txt",776,"2025-11-17 19:25:12","txt"
"./web/flowith/HADER_2030/manus/hader-knowledge/hader-knowledge 2/data/02_operations/whatsapp_last3days.txt",90,"2025-11-17 19:25:12","txt"
"./web/flowith/HADER_2030/manus/hader-knowledge/hader-knowledge 2/data/02_operations/04_yawmiat_tahseelaat.txt",9083,"2025-11-17 19:25:12","txt"
"./web/flowith/HADER_2030/manus/hader-knowledge/hader-knowledge 2/data/02_operations/14_taqreer_alhaykal_waltaaheel_2025.txt",1097,"2025-11-17 19:25:12","txt"
"./web/flowith/HADER_2030/manus/hader-knowledge/hader-knowledge 2/data/02_operations/13_wa_reports_index.txt",982,"2025-11-17 19:25:12","txt"
"./web/flowith/HADER_2030/manus/hader-knowledge/hader-knowledge 2/data/02_operations/05_reports_and_kpis.txt",4005,"2025-11-17 19:25:12","txt"
"./web/flowith/HADER_2030/manus/hader-knowledge/hader-knowledge 2/data/02_operations/SUMMARY.txt",43,"2025-11-17 19:25:12","txt"
"./web/flowith/HADER_2030/manus/hader-knowledge/hader-knowledge 2/data/02_operations/10_wa_last3days_sent_meta.txt",1075,"2025-11-17 19:25:12","txt"
"./web/flowith/HADER_2030/manus/hader-knowledge/hader-knowledge 2/data/02_operations/09_wa_last3days_all_meta.txt",1096,"2025-11-17 19:25:12","txt"
"./web/flowith/HADER_2030/manus/hader-knowledge/hader-knowledge 2/data/02_operations/06_now_shoes_verification_pack.txt",1142,"2025-11-17 19:25:12","txt"
"./web/flowith/HADER_2030/manus/hader-knowledge/hader-knowledge 2/data/02_operations/01_daily_operations_tracker.txt",21217,"2025-11-17 19:25:12","txt"
"./web/flowith/HADER_2030/manus/hader-knowledge/hader-knowledge 2/data/02_operations/07_bazooka_orders_2025_04_198.txt",13784,"2025-11-17 19:25:12","txt"
"./web/flowith/HADER_2030/manus/hader-knowledge/hader-knowledge 2/data/02_operations/whatsapp_ALL_messages.txt",23521057,"2025-11-17 19:25:12","txt"
"./web/flowith/HADER_2030/manus/hader-knowledge/hader-knowledge 2/data/02_operations/wa_last3days_sent.txt",103694,"2025-11-17 19:25:12","txt"
"./web/flowith/HADER_2030/manus/hader-knowledge/hader-knowledge 2/data/02_operations/09_whatsapp_data_sources.txt",1561,"2025-11-17 19:25:12","txt"
"./web/flowith/HADER_2030/manus/hader-knowledge/hader-knowledge 2/data/02_operations/02_yawmiat_tasleemat.txt",7031,"2025-11-17 19:25:12","txt"
"./web/flowith/HADER_2030/manus/hader-knowledge/hader-knowledge 2/data/02_operations/06_operational_costs_log.txt",14809,"2025-11-17 19:25:12","txt"
"./web/flowith/HADER_2030/manus/hader-knowledge/hader-knowledge 2/data/02_operations/12_whatsapp_last3days_meta.txt",998,"2025-11-17 19:25:12","txt"
"./web/flowith/HADER_2030/manus/hader-knowledge/hader-knowledge 2/data/02_operations/03_yawmiat_mortaga3at.txt",6715,"2025-11-17 19:25:12","txt"
"./web/flowith/HADER_2030/manus/hader-knowledge/hader-knowledge 2/data/02_operations/wa_last3days_all.txt",290545,"2025-11-17 19:25:12","txt"
"./web/flowith/HADER_2030/manus/hader-knowledge/hader-knowledge 2/data/05_twins/05-04_process_system_digital_twin.txt",8654,"2025-11-17 20:01:27","txt"
"./web/flowith/HADER_2030/manus/hader-knowledge/hader-knowledge 2/data/05_twins/02_human_digital_twin_engine.txt",9120,"2025-11-17 20:01:27","txt"
"./web/flowith/HADER_2030/manus/hader-knowledge/hader-knowledge 2/data/05_twins/04_kaia_al_himma_agent.txt",1142,"2025-11-17 20:01:27","txt"
"./web/flowith/HADER_2030/manus/hader-knowledge/hader-knowledge 2/data/05_twins/02_kaia_al_asas_agent.txt",1123,"2025-11-17 20:01:27","txt"
"./web/flowith/HADER_2030/manus/hader-knowledge/hader-knowledge 2/data/05_twins/03_kaia_al_itqan_agent.txt",1141,"2025-11-17 20:01:27","txt"
"./web/flowith/HADER_2030/manus/hader-knowledge/hader-knowledge 2/data/05_twins/03_kaia_factory_and_logistics_agents.txt",1328,"2025-11-17 20:01:27","txt"
"./web/flowith/HADER_2030/manus/hader-knowledge/hader-knowledge 2/data/05_twins/05-05_digital_twins_integration_architecture.txt",4655,"2025-11-17 20:01:27","txt"
"./web/flowith/HADER_2030/manus/hader-knowledge/hader-knowledge 2/data/05_twins/05-06_digital_twins_console_and_operations.txt",9505,"2025-11-17 20:01:27","txt"
"./web/flowith/HADER_2030/manus/hader-knowledge/hader-knowledge 2/data/05_twins/05_makc_overview.txt",1177,"2025-11-17 20:01:27","txt"
"./web/flowith/HADER_2030/manus/hader-knowledge/hader-knowledge 2/data/05_twins/02_makc_overview.txt",1365,"2025-11-17 20:01:27","txt"
"./web/flowith/HADER_2030/manus/hader-knowledge/hader-knowledge 2/data/05_twins/01_kaia_overview.txt",1417,"2025-11-17 20:01:27","txt"
"./web/flowith/HADER_2030/manus/hader-knowledge/hader-knowledge 2/data/05_twins/05-03_machine_digital_twin_engine.txt",10576,"2025-11-17 20:01:27","txt"
"./web/flowith/HADER_2030/manus/hader-knowledge/hader-knowledge 2/data/01_constitution/hader_constitution.txt",22672,"2025-11-17 19:25:12","txt"
"./web/flowith/HADER_2030/manus/hader-knowledge/hader-knowledge 2/data/01_constitution/03_laiha_tashgheeliya_hader_2030.txt",16346,"2025-11-17 19:25:12","txt"
"./web/flowith/HADER_2030/manus/hader-knowledge/hader-knowledge 2/data/01_constitution/02_dostour_taseesi_sharikat_hader_2030.txt",14616,"2025-11-17 19:25:12","txt"
"./web/flowith/HADER_2030/manus/hader-knowledge/hader-knowledge 2/data/01_constitution/01_mithaq_taseesi_mashrou3_hader_2030.txt",11951,"2025-11-17 19:25:12","txt"
"./web/flowith/HADER_2030/manus/hader-knowledge/hader-knowledge 2/data/01_constitution/01_mithaq_tasis_hader_2030.txt",1290,"2025-11-17 19:25:12","txt"
"./web/flowith/HADER_2030/manus/hader-knowledge/hader-knowledge 2/data/08_marketing/01_campaign_elle_3amlooh_b2edena_template.txt",1257,"2025-11-17 19:25:35","txt"
"./web/flowith/HADER_2030/manus/hader-knowledge/hader-knowledge 2/data/08_marketing/06_makc_report_md_meta.txt",1112,"2025-11-17 19:25:35","txt"
"./web/flowith/HADER_2030/manus/hader-knowledge/hader-knowledge 2/data/08_marketing/02_campaign_elle_3amlooh_b2edena_production_book.txt",1164,"2025-11-17 19:25:35","txt"
"./web/flowith/HADER_2030/manus/hader-knowledge/hader-knowledge 2/data/08_marketing/04_makc_ads_csv_meta.txt",1116,"2025-11-17 19:25:35","txt"
"./web/flowith/HADER_2030/manus/hader-knowledge/hader-knowledge 2/data/08_marketing/05_makc_plan_md_meta.txt",1062,"2025-11-17 19:25:35","txt"
"./web/flowith/HADER_2030/manus/hader-knowledge/hader-knowledge 2/data/08_marketing/03_hader_project_card_overview.txt",1141,"2025-11-17 19:25:35","txt"
"./web/flowith/HADER_2030/manus/hader-knowledge/hader-knowledge 2/data/03_knowledge/03-05_hka_kaia_haderos_integration.txt",5978,"2025-11-17 19:25:12","txt"
"./web/flowith/HADER_2030/manus/hader-knowledge/hader-knowledge 2/data/03_knowledge/01_hader_bilingual_master_v1_7_1.txt",1170,"2025-11-17 19:25:12","txt"
"./web/flowith/HADER_2030/manus/hader-knowledge/hader-knowledge 2/data/03_knowledge/03-02_hka_knowledge_graph_spec.txt",6481,"2025-11-17 19:25:12","txt"
"./web/flowith/HADER_2030/manus/hader-knowledge/hader-knowledge 2/data/03_knowledge/03_ecart_required_data.txt",1116,"2025-11-17 19:25:12","txt"
"./web/flowith/HADER_2030/manus/hader-knowledge/hader-knowledge 2/data/03_knowledge/03-06_hka_reasoning_templates.txt",6637,"2025-11-17 19:25:12","txt"
"./web/flowith/HADER_2030/manus/hader-knowledge/hader-knowledge 2/data/03_knowledge/03-01_hka_blueprint.txt",2790,"2025-11-17 19:25:12","txt"
"./web/flowith/HADER_2030/manus/hader-knowledge/hader-knowledge 2/data/03_knowledge/03-03_hka_reasoning_engine_spec.txt",5909,"2025-11-17 19:25:12","txt"
"./web/flowith/HADER_2030/manus/hader-knowledge/hader-knowledge 2/data/03_knowledge/03-10_hka_causal_engine.txt",5332,"2025-11-17 19:25:12","txt"
"./web/flowith/HADER_2030/manus/hader-knowledge/hader-knowledge 2/data/03_knowledge/03-09_hka_knowledge_graph_schema.txt",4751,"2025-11-17 19:25:12","txt"
"./web/flowith/HADER_2030/manus/hader-knowledge/hader-knowledge 2/data/03_knowledge/03-04_hader_product_structure_brief_v1_7_3.txt",6244,"2025-11-17 19:25:12","txt"
"./web/flowith/HADER_2030/manus/hader-knowledge/hader-knowledge 2/data/03_knowledge/03-07_hka_knowledge_graph.txt",4806,"2025-11-17 19:25:12","txt"
"./web/flowith/HADER_2030/manus/hader-knowledge/hader-knowledge 2/data/03_knowledge/04_hader_product_structure_brief_v1_7_3.txt",1032,"2025-11-17 19:25:12","txt"
"./web/flowith/HADER_2030/manus/hader-knowledge/hader-knowledge 2/data/03_knowledge/03-08_hka_decision_maps_library.txt",6585,"2025-11-17 19:25:12","txt"
"./web/flowith/HADER_2030/manus/hader-knowledge/hader-knowledge 2/data/03_knowledge/02_hader_product_import_template_v1.txt",1145,"2025-11-17 19:25:12","txt"
"./web/flowith/HADER_2030/manus/hader-knowledge/hader-knowledge 2/data/10_culture/12_hader_system_integrated_analysis_2025-11.txt",2726,"2025-11-17 19:25:35","txt"
"./web/flowith/HADER_2030/manus/hader-knowledge/hader-knowledge 2/data/07_products/06_pop_catalogue_all_models.txt",1200,"2025-11-17 19:25:35","txt"
"./web/flowith/HADER_2030/manus/hader-knowledge/hader-knowledge 2/data/07_products/03_product_M01_filter_wadi_al_naqaa.txt",1234,"2025-11-17 19:25:35","txt"
"./web/flowith/HADER_2030/manus/hader-knowledge/hader-knowledge 2/data/07_products/01_kemit_overview.txt",1253,"2025-11-17 19:25:35","txt"
"./web/flowith/HADER_2030/manus/hader-knowledge/hader-knowledge 2/data/07_products/04_product_M03_pottery_solar_cooler.txt",1285,"2025-11-17 19:25:35","txt"
"./web/flowith/HADER_2030/manus/hader-knowledge/hader-knowledge 2/data/07_products/05_product_B01_toba_khbari.txt",1257,"2025-11-17 19:25:35","txt"
"./web/flowith/HADER_2030/manus/hader-knowledge/hader-knowledge 2/data/07_products/02_method_70_30.txt",1208,"2025-11-17 19:25:35","txt"
"./web/flowith/HADER_2030/manus/hader-knowledge/hader-knowledge 2/data/06_kaia/02_levels_L1_to_L5.txt",1081,"2025-11-17 19:25:35","txt"
"./web/flowith/HADER_2030/manus/hader-knowledge/hader-knowledge 2/data/06_kaia/02_leadership_path_tasks_bank.txt",1229,"2025-11-17 19:25:35","txt"
"./web/flowith/HADER_2030/manus/hader-knowledge/hader-knowledge 2/data/06_kaia/04_hre_and_kaia_in_leadership_evaluation.txt",1331,"2025-11-17 19:25:35","txt"
"./web/flowith/HADER_2030/manus/hader-knowledge/hader-knowledge 2/data/06_kaia/04_kaia_al_himma_agent.txt",1142,"2025-11-17 19:25:12","txt"
"./web/flowith/HADER_2030/manus/hader-knowledge/hader-knowledge 2/data/06_kaia/01_hader_academy_overview_L1_L5.txt",1367,"2025-11-17 19:25:35","txt"
"./web/flowith/HADER_2030/manus/hader-knowledge/hader-knowledge 2/data/06_kaia/02_kaia_al_asas_agent.txt",1123,"2025-11-17 19:25:12","txt"
"./web/flowith/HADER_2030/manus/hader-knowledge/hader-knowledge 2/data/06_kaia/03_kaia_al_itqan_agent.txt",1141,"2025-11-17 19:25:12","txt"
"./web/flowith/HADER_2030/manus/hader-knowledge/hader-knowledge 2/data/06_kaia/03_kaia_factory_and_logistics_agents.txt",1328,"2025-11-17 19:25:12","txt"
"./web/flowith/HADER_2030/manus/hader-knowledge/hader-knowledge 2/data/06_kaia/04_task_bank_and_kpis.txt",1133,"2025-11-17 19:25:35","txt"
"./web/flowith/HADER_2030/manus/hader-knowledge/hader-knowledge 2/data/06_kaia/03_cell_of_9_equity.txt",1220,"2025-11-17 19:25:35","txt"
"./web/flowith/HADER_2030/manus/hader-knowledge/hader-knowledge 2/data/06_kaia/06-02_kaia_context_engine.txt",10654,"2025-11-17 20:02:35","txt"
"./web/flowith/HADER_2030/manus/hader-knowledge/hader-knowledge 2/data/06_kaia/01_hader_academy_overview.txt",1080,"2025-11-17 19:25:35","txt"
"./web/flowith/HADER_2030/manus/hader-knowledge/hader-knowledge 2/data/06_kaia/05_makc_overview.txt",1177,"2025-11-17 19:25:12","txt"
"./web/flowith/HADER_2030/manus/hader-knowledge/hader-knowledge 2/data/06_kaia/02_makc_overview.txt",1365,"2025-11-17 19:25:12","txt"
"./web/flowith/HADER_2030/manus/hader-knowledge/hader-knowledge 2/data/06_kaia/01_kaia_overview.txt",1417,"2025-11-17 19:25:12","txt"
"./web/flowith/HADER_2030/manus/hader-knowledge/hader-knowledge 2/data/06_kaia/03_cell_of_9_equity_promotion.txt",1266,"2025-11-17 19:25:35","txt"
"./web/flowith/HADER_2030/manus/hader-knowledge/hader-knowledge 2/data/09_investment/02_investment_funds_learning_series.txt",1312,"2025-11-17 19:25:35","txt"
"./web/flowith/HADER_2030/manus/hader-knowledge/hader-knowledge 2/data/09_investment/03_hader_financing_philosophy_equity_based.txt",1185,"2025-11-17 19:25:35","txt"
"./web/flowith/HADER_2030/manus/hader-knowledge/hader-knowledge 2/data/09_investment/01_hader_ebs_financial_220425.txt",1202,"2025-11-17 19:25:35","txt"
"./web/flowith/HADER_2030/manus/hader-knowledge/hader-knowledge 2/data/04_haderos/05_security_zero_trust.txt",1251,"2025-11-17 19:25:12","txt"
"./web/flowith/HADER_2030/manus/hader-knowledge/hader-knowledge 2/data/04_haderos/07_hader_contingency_plan_2025_11_15.txt",3585,"2025-11-17 19:25:12","txt"
"./web/flowith/HADER_2030/manus/hader-knowledge/hader-knowledge 2/data/04_haderos/06_hader_master_implementation_plan_2025_11_15.txt",2237,"2025-11-17 19:25:12","txt"
"./web/flowith/HADER_2030/manus/hader-knowledge/hader-knowledge 2/data/04_haderos/03_haderos_data_engine.txt",4375,"2025-11-17 19:25:12","txt"
"./web/flowith/HADER_2030/manus/hader-knowledge/hader-knowledge 2/data/04_haderos/03_human_role_engine.txt",1211,"2025-11-17 19:25:12","txt"
"./web/flowith/HADER_2030/manus/hader-knowledge/hader-knowledge 2/data/04_haderos/04_haderos_knowledge_graph_engine.txt",3862,"2025-11-17 19:25:12","txt"
"./web/flowith/HADER_2030/manus/hader-knowledge/hader-knowledge 2/data/04_haderos/01_haderos_overview.txt",6233,"2025-11-17 19:25:12","txt"
"./web/flowith/HADER_2030/manus/hader-knowledge/hader-knowledge 2/data/04_haderos/05_haderos_event_engine.txt",3814,"2025-11-17 19:25:12","txt"
"./web/flowith/HADER_2030/manus/hader-knowledge/hader-knowledge 2/data/04_haderos/04_digital_twin_layer.txt",8853,"2025-11-17 19:25:12","txt"
"./web/flowith/HADER_2030/manus/hader-knowledge/hader-knowledge 2/data/04_haderos/02_haderos_core_engine.txt",7112,"2025-11-17 19:25:12","txt"
"./web/flowith/HADER_2030/manus/hader-knowledge/hader-knowledge 2/data/04_haderos/02_haderos_architecture_core.txt",15272,"2025-11-17 19:25:12","txt"
"./web/flowith/HADER_2030/manus/hader-knowledge/hader-knowledge 2/data/04_haderos/04_event_engine.txt",5901,"2025-11-17 19:25:12","txt"
"./web/flowith/HADER_2030/manus/hader-knowledge/hader-knowledge 2/data/00_global_architecture/00-06_hader_full_architecture.md",354650,"2025-11-17 20:54:23","md"
"./web/flowith/HADER_2030/manus/hader-knowledge/hader-knowledge 2/indexes/index_schema.md",10485,"2025-11-17 20:04:49","md"
"./web/flowith/HADER_2030/manus/hader-knowledge/hader-knowledge 2/indexes/index.md",82651,"2025-11-17 20:55:25","md"
"./web/flowith/HADER_2030/manus/hader-knowledge/hader-knowledge 2/indexes/index.json",109895,"2025-11-17 20:55:12","json"
"./web/flowith/HADER_2030/manus/hader-knowledge/build_glossary.py",19080,"2025-11-17 20:10:56","py"
"./web/flowith/HADER_2030/manus/hader-knowledge/DELIVERY_MANIFEST.md",10532,"2025-11-17 20:13:18","md"
"./web/flowith/HADER_2030/manus/hader-knowledge/frameworks/temp_file_list.txt",6908,"2025-11-17 19:22:46","txt"
"./web/flowith/HADER_2030/manus/hader-knowledge/frameworks/00_HADEROS_FILE_MAP.md",8997,"2025-11-17 20:03:41","md"
"./web/flowith/HADER_2030/manus/hader-knowledge/frameworks/00_FILES_OVERVIEW.md",8775,"2025-11-17 19:23:53","md"
"./web/flowith/HADER_2030/manus/hader-knowledge/data/02_operations/11_whatsapp_all_messages_meta.txt",1037,"2025-11-17 19:25:12","txt"
"./web/flowith/HADER_2030/manus/hader-knowledge/data/02_operations/08_pop_footwear_costing.txt",776,"2025-11-17 19:25:12","txt"
"./web/flowith/HADER_2030/manus/hader-knowledge/data/02_operations/whatsapp_last3days.txt",90,"2025-11-17 19:25:12","txt"
"./web/flowith/HADER_2030/manus/hader-knowledge/data/02_operations/04_yawmiat_tahseelaat.txt",9083,"2025-11-17 19:25:12","txt"
"./web/flowith/HADER_2030/manus/hader-knowledge/data/02_operations/14_taqreer_alhaykal_waltaaheel_2025.txt",1097,"2025-11-17 19:25:12","txt"
"./web/flowith/HADER_2030/manus/hader-knowledge/data/02_operations/13_wa_reports_index.txt",982,"2025-11-17 19:25:12","txt"
"./web/flowith/HADER_2030/manus/hader-knowledge/data/02_operations/05_reports_and_kpis.txt",4005,"2025-11-17 19:25:12","txt"
"./web/flowith/HADER_2030/manus/hader-knowledge/data/02_operations/SUMMARY.txt",43,"2025-11-17 19:25:12","txt"
"./web/flowith/HADER_2030/manus/hader-knowledge/data/02_operations/10_wa_last3days_sent_meta.txt",1075,"2025-11-17 19:25:12","txt"
"./web/flowith/HADER_2030/manus/hader-knowledge/data/02_operations/09_wa_last3days_all_meta.txt",1096,"2025-11-17 19:25:12","txt"
"./web/flowith/HADER_2030/manus/hader-knowledge/data/02_operations/06_now_shoes_verification_pack.txt",1142,"2025-11-17 19:25:12","txt"
"./web/flowith/HADER_2030/manus/hader-knowledge/data/02_operations/01_daily_operations_tracker.txt",21217,"2025-11-17 19:25:12","txt"
"./web/flowith/HADER_2030/manus/hader-knowledge/data/02_operations/07_bazooka_orders_2025_04_198.txt",13784,"2025-11-17 19:25:12","txt"
"./web/flowith/HADER_2030/manus/hader-knowledge/data/02_operations/whatsapp_ALL_messages.txt",23521057,"2025-11-17 19:25:12","txt"
"./web/flowith/HADER_2030/manus/hader-knowledge/data/02_operations/wa_last3days_sent.txt",103694,"2025-11-17 19:25:12","txt"
"./web/flowith/HADER_2030/manus/hader-knowledge/data/02_operations/09_whatsapp_data_sources.txt",1561,"2025-11-17 19:25:12","txt"
"./web/flowith/HADER_2030/manus/hader-knowledge/data/02_operations/02_yawmiat_tasleemat.txt",7031,"2025-11-17 19:25:12","txt"
"./web/flowith/HADER_2030/manus/hader-knowledge/data/02_operations/06_operational_costs_log.txt",14809,"2025-11-17 19:25:12","txt"
"./web/flowith/HADER_2030/manus/hader-knowledge/data/02_operations/12_whatsapp_last3days_meta.txt",998,"2025-11-17 19:25:12","txt"
"./web/flowith/HADER_2030/manus/hader-knowledge/data/02_operations/03_yawmiat_mortaga3at.txt",6715,"2025-11-17 19:25:12","txt"
"./web/flowith/HADER_2030/manus/hader-knowledge/data/02_operations/wa_last3days_all.txt",290545,"2025-11-17 19:25:12","txt"
"./web/flowith/HADER_2030/manus/hader-knowledge/data/05_twins/05-04_process_system_digital_twin.txt",8654,"2025-11-17 20:01:27","txt"
"./web/flowith/HADER_2030/manus/hader-knowledge/data/05_twins/02_human_digital_twin_engine.txt",9120,"2025-11-17 20:01:27","txt"
"./web/flowith/HADER_2030/manus/hader-knowledge/data/05_twins/04_kaia_al_himma_agent.txt",1142,"2025-11-17 20:01:27","txt"
"./web/flowith/HADER_2030/manus/hader-knowledge/data/05_twins/02_kaia_al_asas_agent.txt",1123,"2025-11-17 20:01:27","txt"
"./web/flowith/HADER_2030/manus/hader-knowledge/data/05_twins/03_kaia_al_itqan_agent.txt",1141,"2025-11-17 20:01:27","txt"
"./web/flowith/HADER_2030/manus/hader-knowledge/data/05_twins/03_kaia_factory_and_logistics_agents.txt",1328,"2025-11-17 20:01:27","txt"
"./web/flowith/HADER_2030/manus/hader-knowledge/data/05_twins/05-05_digital_twins_integration_architecture.txt",4655,"2025-11-17 20:01:27","txt"
"./web/flowith/HADER_2030/manus/hader-knowledge/data/05_twins/05-06_digital_twins_console_and_operations.txt",9505,"2025-11-17 20:01:27","txt"
"./web/flowith/HADER_2030/manus/hader-knowledge/data/05_twins/05_makc_overview.txt",1177,"2025-11-17 20:01:27","txt"
"./web/flowith/HADER_2030/manus/hader-knowledge/data/05_twins/02_makc_overview.txt",1365,"2025-11-17 20:01:27","txt"
"./web/flowith/HADER_2030/manus/hader-knowledge/data/05_twins/01_kaia_overview.txt",1417,"2025-11-17 20:01:27","txt"
"./web/flowith/HADER_2030/manus/hader-knowledge/data/05_twins/05-03_machine_digital_twin_engine.txt",10576,"2025-11-17 20:01:27","txt"
"./web/flowith/HADER_2030/manus/hader-knowledge/data/01_constitution/hader_constitution.txt",22672,"2025-11-17 19:25:12","txt"
"./web/flowith/HADER_2030/manus/hader-knowledge/data/01_constitution/03_laiha_tashgheeliya_hader_2030.txt",16346,"2025-11-17 19:25:12","txt"
"./web/flowith/HADER_2030/manus/hader-knowledge/data/01_constitution/02_dostour_taseesi_sharikat_hader_2030.txt",14616,"2025-11-17 19:25:12","txt"
"./web/flowith/HADER_2030/manus/hader-knowledge/data/01_constitution/01_mithaq_taseesi_mashrou3_hader_2030.txt",11951,"2025-11-17 19:25:12","txt"
"./web/flowith/HADER_2030/manus/hader-knowledge/data/01_constitution/01_mithaq_tasis_hader_2030.txt",1290,"2025-11-17 19:25:12","txt"
"./web/flowith/HADER_2030/manus/hader-knowledge/data/08_marketing/01_campaign_elle_3amlooh_b2edena_template.txt",1257,"2025-11-17 19:25:35","txt"
"./web/flowith/HADER_2030/manus/hader-knowledge/data/08_marketing/06_makc_report_md_meta.txt",1112,"2025-11-17 19:25:35","txt"
"./web/flowith/HADER_2030/manus/hader-knowledge/data/08_marketing/02_campaign_elle_3amlooh_b2edena_production_book.txt",1164,"2025-11-17 19:25:35","txt"
"./web/flowith/HADER_2030/manus/hader-knowledge/data/08_marketing/04_makc_ads_csv_meta.txt",1116,"2025-11-17 19:25:35","txt"
"./web/flowith/HADER_2030/manus/hader-knowledge/data/08_marketing/05_makc_plan_md_meta.txt",1062,"2025-11-17 19:25:35","txt"
"./web/flowith/HADER_2030/manus/hader-knowledge/data/08_marketing/03_hader_project_card_overview.txt",1141,"2025-11-17 19:25:35","txt"
"./web/flowith/HADER_2030/manus/hader-knowledge/data/03_knowledge/03-05_hka_kaia_haderos_integration.txt",5978,"2025-11-17 19:25:12","txt"
"./web/flowith/HADER_2030/manus/hader-knowledge/data/03_knowledge/01_hader_bilingual_master_v1_7_1.txt",1170,"2025-11-17 19:25:12","txt"
"./web/flowith/HADER_2030/manus/hader-knowledge/data/03_knowledge/03-02_hka_knowledge_graph_spec.txt",6481,"2025-11-17 19:25:12","txt"
"./web/flowith/HADER_2030/manus/hader-knowledge/data/03_knowledge/03_ecart_required_data.txt",1116,"2025-11-17 19:25:12","txt"
"./web/flowith/HADER_2030/manus/hader-knowledge/data/03_knowledge/03-06_hka_reasoning_templates.txt",6637,"2025-11-17 19:25:12","txt"
"./web/flowith/HADER_2030/manus/hader-knowledge/data/03_knowledge/03-01_hka_blueprint.txt",2790,"2025-11-17 19:25:12","txt"
"./web/flowith/HADER_2030/manus/hader-knowledge/data/03_knowledge/03-03_hka_reasoning_engine_spec.txt",5909,"2025-11-17 19:25:12","txt"
"./web/flowith/HADER_2030/manus/hader-knowledge/data/03_knowledge/03-10_hka_causal_engine.txt",5332,"2025-11-17 19:25:12","txt"
"./web/flowith/HADER_2030/manus/hader-knowledge/data/03_knowledge/03-09_hka_knowledge_graph_schema.txt",4751,"2025-11-17 19:25:12","txt"
"./web/flowith/HADER_2030/manus/hader-knowledge/data/03_knowledge/03-04_hader_product_structure_brief_v1_7_3.txt",6244,"2025-11-17 19:25:12","txt"
"./web/flowith/HADER_2030/manus/hader-knowledge/data/03_knowledge/03-07_hka_knowledge_graph.txt",4806,"2025-11-17 19:25:12","txt"
"./web/flowith/HADER_2030/manus/hader-knowledge/data/03_knowledge/04_hader_product_structure_brief_v1_7_3.txt",1032,"2025-11-17 19:25:12","txt"
"./web/flowith/HADER_2030/manus/hader-knowledge/data/03_knowledge/03-08_hka_decision_maps_library.txt",6585,"2025-11-17 19:25:12","txt"
"./web/flowith/HADER_2030/manus/hader-knowledge/data/03_knowledge/02_hader_product_import_template_v1.txt",1145,"2025-11-17 19:25:12","txt"
"./web/flowith/HADER_2030/manus/hader-knowledge/data/10_culture/12_hader_system_integrated_analysis_2025-11.txt",2726,"2025-11-17 19:25:35","txt"
"./web/flowith/HADER_2030/manus/hader-knowledge/data/07_products/06_pop_catalogue_all_models.txt",1200,"2025-11-17 19:25:35","txt"
"./web/flowith/HADER_2030/manus/hader-knowledge/data/07_products/03_product_M01_filter_wadi_al_naqaa.txt",1234,"2025-11-17 19:25:35","txt"
"./web/flowith/HADER_2030/manus/hader-knowledge/data/07_products/01_kemit_overview.txt",1253,"2025-11-17 19:25:35","txt"
"./web/flowith/HADER_2030/manus/hader-knowledge/data/07_products/04_product_M03_pottery_solar_cooler.txt",1285,"2025-11-17 19:25:35","txt"
"./web/flowith/HADER_2030/manus/hader-knowledge/data/07_products/05_product_B01_toba_khbari.txt",1257,"2025-11-17 19:25:35","txt"
"./web/flowith/HADER_2030/manus/hader-knowledge/data/07_products/02_method_70_30.txt",1208,"2025-11-17 19:25:35","txt"
"./web/flowith/HADER_2030/manus/hader-knowledge/data/06_kaia/02_levels_L1_to_L5.txt",1081,"2025-11-17 19:25:35","txt"
"./web/flowith/HADER_2030/manus/hader-knowledge/data/06_kaia/02_leadership_path_tasks_bank.txt",1229,"2025-11-17 19:25:35","txt"
"./web/flowith/HADER_2030/manus/hader-knowledge/data/06_kaia/04_hre_and_kaia_in_leadership_evaluation.txt",1331,"2025-11-17 19:25:35","txt"
"./web/flowith/HADER_2030/manus/hader-knowledge/data/06_kaia/04_kaia_al_himma_agent.txt",1142,"2025-11-17 19:25:12","txt"
"./web/flowith/HADER_2030/manus/hader-knowledge/data/06_kaia/01_hader_academy_overview_L1_L5.txt",1367,"2025-11-17 19:25:35","txt"
"./web/flowith/HADER_2030/manus/hader-knowledge/data/06_kaia/02_kaia_al_asas_agent.txt",1123,"2025-11-17 19:25:12","txt"
"./web/flowith/HADER_2030/manus/hader-knowledge/data/06_kaia/03_kaia_al_itqan_agent.txt",1141,"2025-11-17 19:25:12","txt"
"./web/flowith/HADER_2030/manus/hader-knowledge/data/06_kaia/03_kaia_factory_and_logistics_agents.txt",1328,"2025-11-17 19:25:12","txt"
"./web/flowith/HADER_2030/manus/hader-knowledge/data/06_kaia/04_task_bank_and_kpis.txt",1133,"2025-11-17 19:25:35","txt"
"./web/flowith/HADER_2030/manus/hader-knowledge/data/06_kaia/03_cell_of_9_equity.txt",1220,"2025-11-17 19:25:35","txt"
"./web/flowith/HADER_2030/manus/hader-knowledge/data/06_kaia/06-02_kaia_context_engine.txt",10654,"2025-11-17 20:02:35","txt"
"./web/flowith/HADER_2030/manus/hader-knowledge/data/06_kaia/01_hader_academy_overview.txt",1080,"2025-11-17 19:25:35","txt"
"./web/flowith/HADER_2030/manus/hader-knowledge/data/06_kaia/05_makc_overview.txt",1177,"2025-11-17 19:25:12","txt"
"./web/flowith/HADER_2030/manus/hader-knowledge/data/06_kaia/02_makc_overview.txt",1365,"2025-11-17 19:25:12","txt"
"./web/flowith/HADER_2030/manus/hader-knowledge/data/06_kaia/01_kaia_overview.txt",1417,"2025-11-17 19:25:12","txt"
"./web/flowith/HADER_2030/manus/hader-knowledge/data/06_kaia/03_cell_of_9_equity_promotion.txt",1266,"2025-11-17 19:25:35","txt"
"./web/flowith/HADER_2030/manus/hader-knowledge/data/09_investment/02_investment_funds_learning_series.txt",1312,"2025-11-17 19:25:35","txt"
"./web/flowith/HADER_2030/manus/hader-knowledge/data/09_investment/03_hader_financing_philosophy_equity_based.txt",1185,"2025-11-17 19:25:35","txt"
"./web/flowith/HADER_2030/manus/hader-knowledge/data/09_investment/01_hader_ebs_financial_220425.txt",1202,"2025-11-17 19:25:35","txt"
"./web/flowith/HADER_2030/manus/hader-knowledge/data/04_haderos/05_security_zero_trust.txt",1251,"2025-11-17 19:25:12","txt"
"./web/flowith/HADER_2030/manus/hader-knowledge/data/04_haderos/07_hader_contingency_plan_2025_11_15.txt",3585,"2025-11-17 19:25:12","txt"
"./web/flowith/HADER_2030/manus/hader-knowledge/data/04_haderos/06_hader_master_implementation_plan_2025_11_15.txt",2237,"2025-11-17 19:25:12","txt"
"./web/flowith/HADER_2030/manus/hader-knowledge/data/04_haderos/03_haderos_data_engine.txt",4375,"2025-11-17 19:25:12","txt"
"./web/flowith/HADER_2030/manus/hader-knowledge/data/04_haderos/03_human_role_engine.txt",1211,"2025-11-17 19:25:12","txt"
"./web/flowith/HADER_2030/manus/hader-knowledge/data/04_haderos/04_haderos_knowledge_graph_engine.txt",3862,"2025-11-17 19:25:12","txt"
"./web/flowith/HADER_2030/manus/hader-knowledge/data/04_haderos/01_haderos_overview.txt",6233,"2025-11-17 19:25:12","txt"
"./web/flowith/HADER_2030/manus/hader-knowledge/data/04_haderos/05_haderos_event_engine.txt",3814,"2025-11-17 19:25:12","txt"
"./web/flowith/HADER_2030/manus/hader-knowledge/data/04_haderos/04_digital_twin_layer.txt",8853,"2025-11-17 19:25:12","txt"
